Post ID,Title,Body,Author,Publish Date,Total No. of Comments,WC,Analytic,Clout,Authentic,Tone,WPS,Sixltr,Dic,function,pronoun,ppron,i,we,you,shehe,they,ipron,article,prep,auxverb,adverb,conj,negate,verb,adj,compare,interrog,number,quant,affect,posemo,negemo,anx,anger,sad,social,family,friend,female,male,cogproc,insight,cause,discrep,tentat,certain,differ,percept,see,hear,feel,bio,body,health,sexual,ingest,drives,affiliation,achieve,power,reward,risk,focuspast,focuspresent,focusfuture,relativ,motion,space,time,work,leisure,home,money,relig,death,informal,swear,netspeak,assent,nonflu,filler,AllPunc,Period,Comma,Colon,SemiC,QMark,Exclam,Dash,Quote,Apostro,Parenth,OtherP
erg5s5,If you're a teacher please fill out this quick survey!,https://docs.google.com/forms/d/e/1FAIpQLSf5awy5eQu_8lS88gckKz9q59I8B6BYod7_yHoiIRmXVXMbXQ/viewform?usp=sf_link,twetztyler,2020-01-20 09:14:31,0,33,85.63,61.92,16.48,80.64,16.5,15.15,33.33,15.15,6.06,3.03,0,0,3.03,0,0,3.03,3.03,3.03,3.03,0,3.03,0,3.03,0,0,0,3.03,0,3.03,3.03,0,0,0,0,3.03,0,0,0,0,6.06,3.03,0,3.03,3.03,0,3.03,0,0,0,0,0,0,0,0,0,3.03,0,0,3.03,0,0,0,3.03,0,12.12,0,9.09,3.03,3.03,0,0,0,0,0,3.03,0,3.03,0,0,0,45.45,6.06,0,0,0,3.03,3.03,0,0,3.03,0,30.3
erimls,Applications Open for Hundreds of Opportunities For Your Students,"I thought I'd share some awesome programs I found that your students might be interested in :) 

Stanford's Science, Technology, and Reconstructive Surgery (STaRS) Summer Internship Program  
[https://app.scholarahead.com/opportunities/5zKIUXEoM2RtBYvExXRK](https://app.scholarahead.com/opportunities/5zKIUXEoM2RtBYvExXRK)

Apple’s Engineering Technology Camp  
[https://app.scholarahead.com/opportunities/80K1MskvKf7vWidlc2HR](https://app.scholarahead.com/opportunities/80K1MskvKf7vWidlc2HR)

South Carolina Governor’s School for Science and Mathematics  
[https://app.scholarahead.com/opportunities/enYKGvYbAgS7yNpW6RJC](https://app.scholarahead.com/opportunities/enYKGvYbAgS7yNpW6RJC)

Minority Introduction to Engineering and Science (MITES)  
[https://app.scholarahead.com/opportunities/qbDeK6fHIr89q8PwIZQv](https://app.scholarahead.com/opportunities/qbDeK6fHIr89q8PwIZQv)

Princeton Plasma Physics Lab Summer Internship Program  
[https://app.scholarahead.com/opportunities/ZZLoDxOk6dUiJ592Hqm7](https://app.scholarahead.com/opportunities/ZZLoDxOk6dUiJ592Hqm7)

There are hundreds more listed on [app.scholarahead.com](https://app.scholarahead.com/) so check it out :)",MadWander,2020-01-20 11:57:16,0,159,86.26,54.99,1.69,99,79.5,42.14,55.97,14.47,4.4,3.14,1.89,0,1.26,0,0,1.26,0,5.03,2.52,1.26,2.52,0,4.4,1.26,0.63,0,1.26,1.26,10.06,10.06,0,0,0,0,1.89,0,0,0,0,3.14,1.89,0,0,1.26,0,0,0,0,0,0,0.63,0,0.63,0,0,9.43,0.63,6.92,1.89,6.92,0,0.63,2.52,0.63,4.4,0,3.14,1.26,8.81,0,0,0,0,0,17.61,0,15.72,0.63,1.26,0,56.6,15.09,1.26,0,0,0,0,0,0,2.52,10.06,27.67
erjl12,Self-taught vs Traditionally taught Survey,"Hi,

&amp;#x200B;

I am currently doing a study on how different ways of learning computer science can affect a person's programming skills. If anyone would be interested, please take a look at the forms.

If you have completed or are in the process of completing a university education in computer science, please see this survey:

[https://forms.gle/96QeoEU3SpyygZmQ7](https://forms.gle/96QeoEU3SpyygZmQ7)

If you have participated in learning computer science without a university education, please see this survey:

[https://forms.gle/EiJwd4CWNnP1Xvgx5](https://forms.gle/EiJwd4CWNnP1Xvgx5)

There are two programming questions, which you only need to explain your thought process; it does not have to be lengthy. 

&amp;#x200B;

Thank you,

Kevin",zhouke21,2020-01-20 13:00:08,0,128,74.53,65.21,6.1,90.36,25.6,27.34,73.44,38.28,8.59,4.69,0.78,0,3.91,0,0,3.91,5.47,8.59,9.38,2.34,3.91,1.56,18.75,0.78,0.78,1.56,2.34,0,3.91,3.91,0,0,0,0,8.59,0,0,0,0,14.84,3.91,1.56,3.91,4.69,0.78,6.25,2.34,2.34,0,0,0,0,0,0,0,6.25,1.56,0.78,3.12,0.78,0,2.34,14.06,0,4.69,0,3.91,0.78,14.06,0,0,0,0,0,3.12,0,3.12,0,0,0,32.81,5.47,4.69,1.56,3.91,0,0,0.78,0,0.78,3.12,12.5
es13si,Important sorting algorithms for CS Students,,JacobDante,2020-01-21 13:09:37,0,6,99,50,1,99,6,66.67,50,16.67,0,0,0,0,0,0,0,0,0,16.67,0,0,0,0,0,0,0,0,0,0,16.67,16.67,0,0,0,0,0,0,0,0,0,0,0,0,0,0,0,0,0,0,0,0,0,0,0,0,0,33.33,0,0,33.33,0,0,0,0,0,0,0,0,0,16.67,0,0,0,0,0,0,0,0,0,0,0,0,0,0,0,0,0,0,0,0,0,0,0
esi7y2,Best way to study for computer science classes?,I just started take computer science classes. And am struggling with how to best take notes and study for class.,LostAggie2017,2020-01-22 13:07:12,6,28,83.81,36.03,4.35,87.2,9.33,28.57,96.43,39.29,3.57,3.57,3.57,0,0,0,0,0,0,17.86,3.57,7.14,10.71,0,14.29,7.14,7.14,3.57,0,0,10.71,7.14,3.57,3.57,0,0,0,0,0,0,0,3.57,0,3.57,0,0,0,0,0,0,0,0,0,0,0,0,0,17.86,0,7.14,10.71,14.29,0,3.57,10.71,0,7.14,0,3.57,3.57,32.14,0,0,0,0,0,0,0,0,0,0,0,10.71,7.14,0,0,0,3.57,0,0,0,0,0,0
esruy8,Why do I always have something missing in my understanding of topics which always lead me to solve problems incorrectly?,"I am a computer science masters student, I come from a background of engineering and not CS. My problem is whenever I have a problem set, a programming task or an exam, I always try hard to understand the question and think for the right answers, but I usually either get stuck or have a wrong answer. When I seek help I figure out I wasn’t completely understanding the topic of the question itself, missing some part of the information or even having a wrong understanding to some parts.  
So my question is, how can I approach a computer science topic ""for e.g. algorithms, operating systems or programming languages"" and have a good understanding with the right depth, to have a better comprehension and to be able perform better at programming tasks and exams.",markeb95,2020-01-23 03:33:51,10,154,68.29,10.88,97.17,2.61,30.8,24.68,90.91,52.6,11.04,9.09,9.09,0,0,0,0,1.95,10.39,10.39,8.44,5.19,9.09,1.3,13.64,3.9,1.95,3.25,0,2.6,6.49,1.95,4.55,0,0,1.3,3.25,0,0,0,0,24.68,9.74,2.6,1.95,7.79,2.6,5.19,0.65,0,0,0.65,0.65,0,0.65,0,0,11.04,0.65,3.9,2.6,3.25,3.25,1.3,11.04,0,10.39,1.95,4.55,3.9,9.74,0,0,0,0,0,0,0,0,0,0,0,11.69,3.9,5.19,0,0,0.65,0,0,1.3,0.65,0,0
et0btb,CS Education Scholarships,"I came across this interesting scholarship focused specifically on CS education: [https://codepost.io/scholarships/computer-science-education](https://codepost.io/scholarships/computer-science-education)

It would be great if we could compile a list of CS education-focused scholarships. Does anyone know of others?

I know a few student TAs and researchers who have worked on some pretty innovative stuff and I’d love to be able to steer them towards what’s out there.",ASOT600,2020-01-23 14:07:11,0,79,59.1,55.02,8.23,97,19.75,31.65,79.75,43.04,15.19,6.33,3.8,1.27,0,0,1.27,8.86,2.53,11.39,10.13,2.53,3.8,0,15.19,2.53,0,2.53,0,2.53,5.06,5.06,0,0,0,0,6.33,0,0,0,0,12.66,2.53,0,3.8,5.06,1.27,2.53,0,0,0,0,1.27,0,0,0,0,13.92,2.53,2.53,7.59,1.27,0,2.53,8.86,0,7.59,1.27,6.33,0,21.52,0,0,6.33,0,0,2.53,0,2.53,0,0,0,29.11,5.06,0,1.27,0,1.27,0,6.33,0,2.53,2.53,10.13
etos3r,New E-Learning CPD: Metacognition &amp; Self-Regulated Learning (Online Teacher Training Course),,Learning-Power,2020-01-25 01:29:02,0,13,93.26,77.92,63.54,25.77,13,46.15,53.85,0,0,0,0,0,0,0,0,0,0,0,0,0,0,0,15.38,7.69,0,0,0,0,0,0,0,0,0,0,7.69,0,0,0,0,15.38,15.38,0,0,0,0,0,0,0,0,0,0,0,0,0,0,15.38,0,0,15.38,0,0,0,0,0,7.69,0,0,7.69,38.46,0,0,0,0,0,0,0,0,0,0,0,53.85,0,0,7.69,7.69,0,0,15.38,0,0,15.38,7.69
eumgb6,Free online C# boot camp,"70 students, 15 mentors, 5 lessons and 100  homework submissions via pull requests. 
Programming is fun, so is learning it! You don't need to pay for studies if you know where to look for resources. One such resource is our community- C# Inn. We help people with programming of all levels. Right now we have an ongoing boot camp called ""From Zero to Hero"".  It's dedicated to get people with 0 XP started with programming, or inexperienced programmers get experience with how to write proper, practical, clean code and work with open source. 2 weekly programming lessons, homework, constant mentor feedback and code reviews, automated code reviews and tests, great supportive community.  8 chapters and roughly 70~80 lessons to put you on track with enough experience to land a job!  
Here is the material of the last two lessons:

**Lesson 4: Logical flow**  
Slides: https://docs.google.com/presentation/d/1UBuFbvh4H7CtyCP9NnWOa3cTOZmb8zjDJjZCxhG-D2I/edit?usp=sharing  
Twitch: https://www.twitch.tv/videos/540125670  
Git: https://github.com/csinn/CSharp-From-Zero-To-Hero/blob/Chapter1/Lesson/Logical-Flow/Src/BootCamp.Chapter/Program.cs  
Youtube: https://youtu.be/uuCx4T3NqmU  
Homework:
https://github.com/csinn/CSharp-From-Zero-To-Hero/blob/Chapter1/Homework/4/
Note a few mistakes in video.  

**Lesson 5: Loops and arrays**   
Slides: https://docs.google.com/presentation/d/1drg2UNGkh2SypFR5MH7pcNbUYlii-tQXqVkh1qQh_Z0/edit?usp=sharing  
Twitch video: https://www.twitch.tv/videos/541694181  
Git: https://github.com/csinn/CSharp-From-Zero-To-Hero/tree/Chapter1/Lesson/Arrays-And-Loops  
Homework:https://github.com/csinn/CSharp-From-Zero-To-Hero/tree/Chapter1/Homework/5  

It's never too late to start learning and have a solid base. Boot camp is only 3 weeks in, so you can still join! Would you like to learn? Would you like to help others? Maybe both? If interested, here is an invitation link:  
https://discord.gg/rCMKcUU",CSharp-Inn,2020-01-27 02:56:17,0,336,87.18,74.38,9.4,90.04,19.76,20.54,65.48,26.79,3.87,2.68,0,0.89,1.79,0,0,1.19,2.08,9.82,4.46,3.87,4.17,0.6,11.9,2.68,0,0.6,6.85,1.19,4.46,4.17,0.3,0,0,0,5.65,0,0,0,0,8.33,4.46,0.6,1.79,1.19,0.6,1.19,2.08,1.49,0,0,1.19,0,1.19,0,0,5.36,2.98,0.3,1.79,0.89,0,0.6,9.82,0,9.23,2.98,3.27,2.98,12.2,2.68,1.79,0.6,0,0,3.27,0,3.27,0,0,0,44.94,7.44,3.57,3.87,0,1.49,0.89,6.55,0.6,0.89,0,19.64
eupz1h,Students Don’t Need Simple Examples (They need clear ones),,danilodf,2020-01-27 08:14:21,7,9,18.82,50,1,25.77,9,22.22,77.78,22.22,11.11,11.11,0,0,0,0,11.11,0,0,0,11.11,0,0,11.11,33.33,22.22,0,0,0,0,0,0,0,0,0,0,11.11,0,0,0,0,33.33,0,0,22.22,0,11.11,0,11.11,11.11,0,0,0,0,0,0,0,11.11,0,0,11.11,0,0,0,33.33,0,0,0,0,0,11.11,0,0,0,0,0,0,0,0,0,0,0,33.33,0,0,0,0,0,0,0,0,11.11,22.22,0
evqlg3,best short course intro to machine learning?,"I've seen these programs \[Berkley\]([https://ucberkeleyischool-online.getsmarter.com/presentations/lp/berkeley-machine-learning-online-short-course/](https://ucberkeleyischool-online.getsmarter.com/presentations/lp/berkeley-machine-learning-online-short-course/)), \[cornell\]([https://www.ecornell.com/certificates/technology/machine-learning/](https://www.ecornell.com/certificates/technology/machine-learning/)), \[MIT\]([https://executive.mit.edu/openenrollment/program/machine-learning-implementation-in-business-self-paced-online/](https://executive.mit.edu/openenrollment/program/machine-learning-implementation-in-business-self-paced-online/))

&amp;#x200B;

I want to get into a Masters Program, but before I do that, I want to get a little taste of it, and start thinking and maybe even working on it at my current job. Has anyone taken any of these, or other similar courses? do you recommend any of them? I have tuition reimbursement, and they are well below the threshold, and I do have the engineering background for it, Software and Systems Engineer.",scruffy_Looking_,2020-01-29 10:10:40,6,167,76.62,45.24,27.24,47.95,33.4,34.13,64.67,31.74,10.78,5.99,4.19,0,0.6,0,1.2,4.79,2.4,8.38,4.79,1.8,4.19,0,14.37,3.59,1.8,0,0,1.2,1.2,1.2,0,0,0,0,4.19,0,0,0,0,10.18,4.79,0,1.2,2.99,0,1.8,1.2,0.6,0,0,0.6,0,0,0,0.6,5.39,0,1.2,2.99,2.4,0,1.2,8.38,0,7.78,0,5.99,1.8,15.57,0,0,2.4,0,0,4.19,0,3.59,0,0.6,0,71.26,8.38,5.39,0,1.2,1.8,0,16.77,0,0.6,7.19,29.94
ew5xa4,Should I learn Japanese as a cse student or any other language?,,Curious_gagan,2020-01-30 06:06:10,3,12,38.6,4.8,74.76,25.77,12,25,83.33,50,16.67,8.33,8.33,0,0,0,0,8.33,8.33,8.33,8.33,0,16.67,0,16.67,8.33,8.33,0,0,8.33,0,0,0,0,0,0,8.33,0,0,0,0,41.67,8.33,0,8.33,16.67,0,16.67,0,0,0,0,0,0,0,0,0,8.33,0,0,8.33,0,0,0,8.33,0,0,0,0,0,16.67,0,0,0,0,0,0,0,0,0,0,0,8.33,0,0,0,0,8.33,0,0,0,0,0,0
ewvpuw,Can anyone post a example of their CS class notes that they use? I’m really struggling with how to take notes for a CS class.,"There just seems to be so much complicated information and so much reading for my classes right now. And I know it’s only going to get harder and more complicated going forward. 

Does anyone have some examples they are willing to share of how to take effective notes for a CS class? 

If you want to privately pm me too that’s fine! Any help would be greatly appreciated.",lauraundercover,2020-01-31 13:57:32,6,93,30.84,62.65,26.35,66.47,13.29,15.05,88.17,52.69,13.98,8.6,4.3,0,1.08,0,3.23,5.38,3.23,12.9,10.75,10.75,8.6,0,20.43,6.45,2.15,2.15,0,5.38,5.38,3.23,1.08,1.08,0,0,8.6,0,0,0,0,19.35,7.53,4.3,3.23,6.45,0,2.15,1.08,0,0,1.08,0,0,0,0,0,7.53,2.15,0,2.15,4.3,0,0,19.35,2.15,6.45,3.23,2.15,2.15,4.3,0,0,0,0,0,0,0,0,0,0,0,10.75,4.3,0,0,0,2.15,1.08,0,0,3.23,0,0
exfggv,Using Fusion 360 with a whole class?,"Is anyone using Fusion 360 with younger kids?  I'm in a middle school and it was a nightmare to get kids to sign up for an educational account.  It worked with some, others got a 30 day trial.  Not sure what went wrong (or right).  Is there a better way to sign up a whole class?  Thanks!",Scatropolis,2020-02-01 16:22:13,3,64,96.62,37.72,45.44,55.21,9.14,6.25,87.5,46.88,9.38,1.56,1.56,0,0,0,0,7.81,10.94,15.62,6.25,1.56,3.12,1.56,17.19,7.81,4.69,1.56,4.69,4.69,7.81,4.69,3.12,0,0,0,4.69,0,0,0,0,12.5,0,3.12,0,4.69,1.56,4.69,0,0,0,0,0,0,0,0,0,10.94,0,3.12,3.12,4.69,1.56,6.25,7.81,0,14.06,1.56,9.38,3.12,7.81,0,0,1.56,0,0,0,0,0,0,0,0,17.19,4.69,1.56,0,0,4.69,1.56,0,0,1.56,3.12,0
exlayu,I would greatly appreciate some feedback on my slides!,"[https://speakerdeck.com/antecedent/introduction-to-programming-with-python](https://speakerdeck.com/antecedent/introduction-to-programming-with-python) 

It's intended as a (beginning of a) material for complete beginners. However, I have no plans of deploying this anyplace serious, at least this version. I made this entirely as a hobby, trying out various metaphors just for the sake of it. 

I do, however, consider (rather abstractly) a CSE career for my future self once in a while, and would like to improve in my amateur efforts, so that I can, at least, gauge my potential for the field.

As such, if anyone here could criticize the material, I would be immensely grateful!",antecedent,2020-02-02 00:08:12,0,123,75.29,12.75,30.18,56.48,20.5,29.27,81.3,52.85,13.82,8.13,8.13,0,0,0,0,5.69,6.5,17.07,7.32,5.69,7.32,0.81,9.76,5.69,4.88,0,0.81,4.07,4.88,3.25,1.63,0,0.81,0,1.63,0,0,0,0,15.45,1.63,1.63,4.88,4.07,1.63,4.07,1.63,0,1.63,0,0,0,0,0,0,4.88,0,4.07,0.81,0,0,0.81,5.69,2.44,8.94,0.81,4.88,3.25,4.07,0.81,0,0,0,0,1.63,0,1.63,0,0,0,34.15,4.88,8.94,0,0,0,1.63,6.5,0,0.81,4.88,6.5
exlbdp,I would greatly appreciate some feedback on my slides,"[https://speakerdeck.com/antecedent/introduction-to-programming-with-python](https://speakerdeck.com/antecedent/introduction-to-programming-with-python)

It's intended as a (beginning of a) material for complete beginners. However, I have no plans of deploying this anyplace serious, at least this version. I made this entirely as a hobby, trying out various metaphors just for the sake of it.

I do, however, consider (rather abstractly) a CSE career for my future self once in a while, and would like to improve in my amateur efforts, so that I can, at least, gauge my potential for the field.

As such, if anyone here could criticize the material, I would be immensely grateful!",antecedent,2020-02-02 00:09:21,8,123,75.29,12.75,30.18,56.48,20.5,29.27,81.3,52.85,13.82,8.13,8.13,0,0,0,0,5.69,6.5,17.07,7.32,5.69,7.32,0.81,9.76,5.69,4.88,0,0.81,4.07,4.88,3.25,1.63,0,0.81,0,1.63,0,0,0,0,15.45,1.63,1.63,4.88,4.07,1.63,4.07,1.63,0,1.63,0,0,0,0,0,0,4.88,0,4.07,0.81,0,0,0.81,5.69,2.44,8.94,0.81,4.88,3.25,4.07,0.81,0,0,0,0,1.63,0,1.63,0,0,0,33.33,4.88,8.94,0,0,0,0.81,6.5,0,0.81,4.88,6.5
exyyjb,"I use codingbat in my class. Teacher reports are a pain to read, so I made an app. Hope it's useful to someone else.",,scfoothills,2020-02-02 17:22:08,2,24,62.04,10.58,23.51,92.4,8,16.67,95.83,50,20.83,12.5,12.5,0,0,0,0,8.33,8.33,12.5,8.33,4.17,4.17,0,25,0,0,0,0,0,12.5,8.33,4.17,0,0,0,4.17,0,0,0,0,20.83,0,8.33,4.17,8.33,0,4.17,4.17,0,0,4.17,4.17,0,4.17,0,0,4.17,0,0,4.17,0,0,4.17,16.67,4.17,4.17,0,4.17,0,16.67,0,0,0,0,0,4.17,0,4.17,0,0,0,20.83,12.5,4.17,0,0,0,0,0,0,4.17,0,0
ey10g1,Using Board Games to Gamify Computer Literacy Education,"A very interesting board game up on kickstarter now to implicitly teach the fundamentals of networking and cyber security from Singapore. Went for a playtest yesterday and was surprised by how naturally I was thinking about abstract ideas about graphs and networks.

[Here](https://www.kickstarter.com/projects/codomo/potato-pirates-2-enter-the-spudnet?ref=bneewn)'s the link to their kickstarter page! Go on for more information and to support them!",volov99,2020-02-02 19:58:50,0,82,96.05,64.29,25.63,96.29,16.4,29.27,68.29,39.02,3.66,3.66,1.22,0,0,0,2.44,0,6.1,17.07,2.44,7.32,6.1,0,9.76,2.44,1.22,1.22,1.22,1.22,4.88,4.88,0,0,0,0,4.88,0,0,0,0,9.76,4.88,2.44,0,0,2.44,0,0,0,0,0,1.22,0,0,0,1.22,7.32,2.44,0,3.66,0,1.22,4.88,4.88,0,10.98,3.66,4.88,2.44,4.88,2.44,0,0,0,0,1.22,0,1.22,0,0,0,26.83,4.88,0,0,0,1.22,2.44,6.1,0,1.22,2.44,8.54
eypiwn,The 3 Ways To Become A Millionaire,,greenjazbati,2020-02-04 04:46:04,0,7,99,50,13.15,25.77,7,14.29,71.43,57.14,0,0,0,0,0,0,0,0,28.57,14.29,14.29,0,0,0,14.29,0,0,0,28.57,0,0,0,0,0,0,0,0,0,0,0,0,14.29,14.29,0,0,0,0,0,0,0,0,0,0,0,0,0,0,0,0,0,0,0,0,0,14.29,0,0,0,0,0,0,0,0,0,0,0,0,0,0,0,0,0,0,0,0,0,0,0,0,0,0,0,0,0
eypj6c,"""The Compound Effect"" by Darren Hard BOOK SUMMARY",,greenjazbati,2020-02-04 04:46:44,0,8,99,50,7.84,25.77,8,25,62.5,25,0,0,0,0,0,0,0,0,12.5,12.5,0,0,0,0,0,12.5,0,0,0,0,0,0,0,0,0,0,0,0,0,0,0,12.5,12.5,12.5,0,0,0,0,12.5,0,0,12.5,0,0,0,0,0,0,0,0,0,0,0,0,0,0,0,0,0,0,12.5,12.5,0,0,0,0,0,0,0,0,0,0,25,0,0,0,0,0,0,0,25,0,0,0
eyr3cr,Java or Python for High School? Our great debate,"A little background:
I teach high school CS in a district with about 4000 high school students.  We currently offer an Intro to Programming course that is Java based (AP Programming Light since we abandoned Alice), AP Computer Programming (Java based) and AP-CSP which is language independent.

We're updating our curriculum so that the intro course is more interesting and accessible to a wider audience.  We found that 75% of students who take the intro course don't move on to AP. 

We've looked at scratch (no coding), codehs (too similar to our current course and not ""fun"", and Carnegie Mellon (looks great but uses python instead of java).  At the other end of our debate is whether these courses would prepare students for AP Programming, which is Java based.   If we use Python or no coding in the intro course, then our students would be less comfortable transitioning to AP. 

I'm curious what others would do in this instance.  How can we open the course to a wider audience by using drag and drop or Python with Carnegie Mellon's curriculum without shortchanging our students who want to be prepared for an AP level course?

Any suggestions of other curriculum is appreciated!",davidpm,2020-02-04 06:49:12,54,211,67.25,74.66,25.57,70.37,17.58,20.38,81.99,46.45,13.27,7.11,0.95,6.16,0,0,0,6.16,5.21,12.32,7.58,2.37,6.64,2.37,13.74,5.69,2.37,3.32,0.95,1.42,3.32,2.84,0.47,0,0,0.47,9.48,0,0,0,0,13.74,1.42,4.27,2.37,2.37,0,5.69,1.9,1.42,0,0.47,0,0,0,0,0,12.32,6.16,0,4.27,1.9,0,1.42,10.43,1.42,11.37,0.95,7.11,3.32,11.85,0.47,0,0,0,0,0,0,0,0,0,0,16.59,3.79,2.37,0.47,0,0.95,0.47,0.47,0.95,2.37,4.27,0.47
ez3k9y,Programming a Samsung Gear?,"Does anyone have experience programming a Samsung Gear 2? I've never done a project with a smartwatch before but this is what I want to do:

**Detect the gesture** of a dumbbell curl at the gym, and once finished curling start the timer on the watch to time a set.

Anyone have any advice on how to pull this sensor data from the watch or other tips?",anonymouspsy,2020-02-04 20:16:19,0,71,91.86,33.62,50.85,25.77,17.75,15.49,80.28,56.34,11.27,2.82,2.82,0,0,0,0,8.45,15.49,14.08,9.86,2.82,5.63,1.41,15.49,1.41,1.41,2.82,2.82,1.41,0,0,0,0,0,0,4.23,0,0,0,0,12.68,0,1.41,1.41,5.63,1.41,4.23,4.23,2.82,0,0,0,0,0,0,0,0,0,0,0,0,0,2.82,14.08,0,15.49,2.82,4.23,8.45,4.23,1.41,0,0,0,0,0,0,0,0,0,0,15.49,1.41,1.41,1.41,0,4.23,0,0,0,1.41,0,5.63
ezjvq3,Computer Science and Technology Education,"I am a sophomore in high school.

I use Linux as my main operating system and I've created my own website that I pay for hosting and I manage through ssh and ftp. I also do programming in python and C.

As I've learned these skills over the past few years, I've noticed that there really isn't anyone else doing stuff like this. At my middle school I only knew one other guy that liked programming and at my high school there are only three guys that program for fun. The problem I see with the educational system as it is currently is that unless you have a mentor outside of school or you're smart enough to learn through the internet, most people will never have a chance to learn these skills.

I am not arguing for everyone to learn advanced topics like binary trees, linked lists, object oriented programming, but rather a basic education in how to use the tools that are on computers so that students can be efficient and do work well. I have had so many experiences when I see a student asked to do something, and they either don't know how to do it or they do it in some strange and difficult way. An example of this is when a peer was trying to make a color on their logo transparent. They seemed confident and opened up Microsoft word and pasted the image in to edit the image. Yes, Microsoft word. This student was a Junior. There is just a lack of understanding of the platforms and technologies that govern our lives. This may be a tad dramatic, but I worry that this is ruining our generation.

The job market in software development is competitive - not for the people trying to get hired but the companies hiring them. There is a massive demand for programmers and that demand is not being met.

It amazes me that there is such a discrepancy in the incredible technology we have today (computers, self driving cars, the internet) with the lack of skill in using those technologies.

A solution to this problem could be a class implemented into the high school curriculum that teaches students how to use their operating system effectively, and more importantly, to to teach them how to learn from the internet to become more proficient in those tools.

I hope this wan't too much of a rant.

What do you think? If you're a teacher, what are your views on this problem? Students, do you agree with my arguments?",phylopylo,2020-02-05 16:48:35,19,430,50.06,43.53,34.47,29.66,18.7,17.44,89.77,57.44,16.74,8.6,4.88,0.7,1.4,0,1.63,8.14,7.67,13.02,10.47,5.35,7.67,1.4,17.44,4.65,2.33,1.86,0.47,1.86,4.42,2.33,2.09,0.23,0.47,0.23,6.28,0,0.47,0,0.47,13.72,3.49,2.79,2.09,3.02,0.7,3.72,1.63,1.4,0,0,0.7,0,0.7,0,0,10.93,0.93,3.02,5.81,0.7,1.4,3.02,13.49,0.7,8.6,0.47,6.28,1.86,12.09,0.47,0,0.47,0,0,0.7,0,0,0.47,0.23,0,10.93,4.42,3.26,0,0,0.7,0,0.23,0,1.86,0.47,0
ezspt7,Online Web Development Mentoring Program,"Hey guys!

A friend and I are starting a web development program - the gist is to basically develop web apps from scratch using the latest tech frameworks. All will be done online and free :)

For the first web app, we've chosen VueJS, Tailwind CSS, and Firebase.

If interested, you can find out more below

[https://webdevofficehours.com/#freementorship](https://webdevofficehours.com/#freementorship)

We are gonna cap this to 20-30 people - so subscribe! It's first come, first serve.

Paul",pberesuita,2020-02-06 05:58:33,2,87,72.34,82.12,8.19,85.87,12.43,20.69,67.82,34.48,6.9,4.6,1.15,2.3,1.15,0,0,2.3,5.75,6.9,10.34,2.3,5.75,0,14.94,3.45,2.3,0,5.75,2.3,3.45,3.45,0,0,0,0,8.05,0,2.3,0,1.15,4.6,1.15,1.15,1.15,1.15,1.15,1.15,1.15,0,0,1.15,0,0,0,0,0,9.2,3.45,3.45,2.3,0,0,2.3,9.2,2.3,10.34,2.3,2.3,5.75,6.9,0,0,1.15,0,0,8.05,0,6.9,0,0,0,31.03,5.75,5.75,0,0,0,2.3,3.45,0,2.3,2.3,9.2
f00m6n,Riffing on the CS Ed Podcast - Episode 1 - David Malan,,zamansky,2020-02-06 14:45:02,0,10,99,50,3.37,25.77,10,30,30,20,0,0,0,0,0,0,0,0,10,10,0,0,0,0,0,0,0,0,10,0,0,0,0,0,0,0,0,0,0,0,0,0,0,0,0,0,0,0,0,0,0,0,0,0,0,0,0,0,0,0,0,0,0,0,0,0,10,0,10,0,0,10,0,0,0,0,0,0,0,0,0,0,20,0,0,0,0,0,0,20,0,0,0,0
f0c7w9,TensorFlow + Gesture Recognition on Smart Watch?,"For a class project, we're given a **Garmin Venu** smartwatch.

We want to use the sensor data on the watch to be able to train a machine learning model to learn the gesture of curling a dumbbell and counting the **number of reps**.

We've never used TensorFlow before, does anyone have any advice for our project? We don't care about false positives.",anonymouspsy,2020-02-07 07:45:21,1,68,97.21,92.92,6.2,94.01,13.6,20.59,76.47,47.06,8.82,7.35,0,7.35,0,0,0,1.47,11.76,17.65,7.35,2.94,1.47,2.94,19.12,2.94,1.47,0,0,1.47,4.41,4.41,0,0,0,0,10.29,0,0,0,0,14.71,4.41,2.94,1.47,2.94,2.94,0,2.94,2.94,0,0,0,0,0,0,0,10.29,7.35,1.47,0,1.47,0,4.41,16.18,0,8.82,2.94,2.94,2.94,7.35,0,0,0,0,0,0,0,0,0,0,0,27.94,4.41,2.94,0,0,2.94,0,0,0,4.41,0,13.24
f1dr4l,Variables in Python,,KartheekRavula,2020-02-09 11:37:28,1,3,99,50,98.01,25.77,3,33.33,66.67,33.33,0,0,0,0,0,0,0,0,0,33.33,0,0,0,0,0,0,0,0,0,0,0,0,0,0,0,0,0,0,0,0,0,33.33,0,0,0,33.33,0,0,0,0,0,0,0,0,0,0,0,0,0,0,0,0,0,0,0,0,33.33,0,33.33,0,0,0,0,0,0,0,0,0,0,0,0,0,0,0,0,0,0,0,0,0,0,0,0,0
