f1fyxi,My code works -- and I have no idea why!!!,,zamansky,2020-02-09 14:03:52,4,9,1,1,98.01,25.77,9,0,88.89,66.67,22.22,22.22,22.22,0,0,0,0,0,0,0,11.11,11.11,11.11,11.11,22.22,0,0,11.11,0,0,0,0,0,0,0,0,0,0,0,0,0,22.22,11.11,11.11,0,0,0,0,0,0,0,0,0,0,0,0,0,11.11,0,11.11,0,0,0,0,22.22,0,0,0,0,0,11.11,0,0,0,0,0,0,0,0,0,0,0,55.56,0,0,0,0,0,33.33,22.22,0,0,0,0
f1pmeg,"Back End, Front End, or Testing","Hello, 
I'm a CS student and I have a SWE project this semester in which I can join the Back End, Front End, or Testing team so my question what is the best choice? Considering that I want to get an internship this summer and I will learn from scratch whatever the team I join.",ahmedashrafhamdy,2020-02-10 04:28:49,3,61,31.06,20.62,99,56.75,20.33,16.39,95.08,54.1,21.31,11.48,11.48,0,0,0,0,9.84,9.84,4.92,8.2,4.92,8.2,0,19.67,1.64,1.64,4.92,0,0,1.64,1.64,0,0,0,0,6.56,0,0,0,0,11.48,6.56,0,1.64,4.92,0,3.28,1.64,0,0,1.64,0,0,0,0,0,13.11,8.2,4.92,3.28,3.28,0,0,14.75,1.64,18.03,0,8.2,13.11,13.11,3.28,0,0,0,0,0,0,0,0,0,0,13.11,1.64,8.2,0,0,1.64,0,0,0,1.64,0,0
f1wbzj,Education advice please ^^,"Hi, I'm an electronic engineering student about to graduate in the Netherlands and I have some quick questions, should I go off-topic please correct me \^\^  


So my story is quite simple, I have been in the electronic engineering field for a couple years now and in the light of the increasing automation and just for the sake of knowledge that interests me I want to follow up my current education with one in computer science.  
I'm thinking software engineering I mainly enjoy making applications or extensions for existing ones, kind of the design aspect of things I think.  


However I want to study abroad, I would like to follow an education in Japan, I've been looking here and there for what university and education would be best but I figured I'd consult some people that have experience on the topic, hence posting here.  


Should it be relevant my current education is on the Dutch MBO-4 level and the title is engineering technician electronics if memory serves.  
Any advice is appreciated regardless where you're from, if it makes me wiser on the situation I'll gladly hear it :)",ShinraSan,2020-02-10 12:28:41,4,191,58.88,20.12,66.53,97.5,31.83,23.04,84.82,51.83,14.66,10.99,10.47,0,0.52,0,0,3.66,6.81,12.57,10.99,5.24,6.28,0,16.75,2.09,1.05,1.05,1.05,2.09,5.24,5.24,0,0,0,0,4.19,0,0,0,0,15.71,4.19,1.57,4.71,5.24,0.52,2.62,2.09,1.05,0.52,0,0,0,0,0,0,4.71,0.52,0.52,4.19,0.52,0,1.05,12.57,0.52,10.99,2.09,6.28,2.62,6.81,0,0,0,0,0,0.52,0,0.52,0,0,0,13.61,2.09,4.19,0,0,0,0,1.05,0,3.14,0,3.14
f225pq,What would you do - 5th grade dilemma,"I'm looking for some input for what to do in my situation.  I am at a very small, rural K-8 school.  Coding is part of their curriculum, beginning in Kinder with code.org.  This year, I introduced arduino boards to my middle school aged students as an incentive to get them to move onto a text based language.  They loved it, and things have been going great.  

After winter break, half of the fifth grade class began getting pulled for academic intervention half way through our Friday tech class.  I should also say I only see them twice a week.  The students I was left with were my strongest coders, who (in block language) under stand concepts such as functions, variables, conditional statements, and count controlled loops.  With this setup, I started doing video game design with everyone and they are loving it.  When half the class is gone for intervention, I pulled out arduino boards for those who are left and have them working on those, using c++.

Here is the dilemma.  I need something to fill that 25 minute time slot when half the class is gone.  These students are ready to make the jump to a text language, and are excited to do so.  Our classes are small, and with purchasing one extra board, we were set to go.  Unfortunately, the students who leave also want to play with the boards, and their teacher wants to find a way to give everyone the opportunity before students become resentful of having to be pulled to receive extra help. I am torn however.  Not everyone is ready to leave block languages, and while I can use mBlock, I would love to keep arduinos as my motivation to try a ""real"" programming language. I am also stuck with that extra time.  Right now I have the others getting enrichment that they are ready for.  Either I give them something exciting that they want to do, or free time, which I would rather avoid.  

So what would you do?",gufyduck,2020-02-10 19:14:10,3,346,53.71,64.66,42.99,82.63,15.73,15.61,87.86,53.76,17.34,10.12,5.78,0.87,0.58,0,2.89,7.23,4.91,13.87,10.69,4.05,6.07,0.29,20.81,5.2,2.31,2.6,2.6,1.73,4.91,4.05,0.87,0.29,0.29,0,10.12,0,0,0,0,9.25,1.16,1.73,2.89,1.73,0.87,1.73,1.16,0.87,0.29,0,0.58,0,0,0,0,8.96,2.31,1.45,3.47,2.02,0.29,3.18,13.29,0.58,14.16,3.47,5.2,5.49,6.07,0.87,0,0.58,0,0,0.29,0,0.29,0.29,0,0,15.03,6.07,6.07,0,0,0.29,0,0.58,0.58,0.29,0.58,0.58
f3g5mx,How to Modernize our Highschool CS Program?,"TL;DR:  Adding CS classes to our current small curriculum.  Would like our students to be prepared for their future industry and college experiences.

Hi!  I'm a high school teacher at Burlington High School in Iowa.  My principal asked me to investigate what would be a desirable curriculum for students going into University of Iowa.

We currently have:

\-An Introduction to Programming class

One trimester.  Covers several languages including how to use C# with Visual Studio

\-Computer Science Principles

We mostly teach Python using PLTW's curriculum, but we are currently looking at alternatives, partly due to recent changes in PLTW's program.  This is treated as our second course after Intro to Programming.

We are looking into adding:

\-A 1 trimester app development class that (I think) focuses on using C# with Visual Studios.  One of our teachers already has materials for this and looks forward to teaching it.  

These three classes would be the first 2 years of our program, but we would like to expand.  

The intro and app class are small.  So we are also looking to add at least 3 more trimesters of classes, where classes range in size from 1 to 3 trimesters.

Here are some of the options we are considering.  Some of these may be offered as independent studies too, such as Data Science.:

\-High Industry demand, but somewhat niche:    

Data Science, Cyber Security, Machine Learning, Additional app learning

\-High Student Demand courses, but may not be best for industry or college preparation. (Possibly as a carrot to take the introductory classes):

Video Game Development

We could offer more classes if they were small.  We also are thinking about using the last year as a project based capstone course where they might work on an app for a business for example.  Would you recommend this?  

The principal also wants classes that flow into eachother fairly well in a way that encourages high skill and rigor at the ending courses.  Though I'm not sure that this is as necessary with Computer Science.  For example, CSA is one of the more challenging classes, but I think it could be tackled after taking 2 trimesters of programming and not 5 trimesters if its the course we add.  But a strict order to the curriculum is very advantageous or allow us to do more with the third and fourth year classes?

Thanks for your time!",AduroMelior,2020-02-13 12:19:24,26,405,75.9,73.14,17.14,72.05,16.88,25.68,87.41,46.67,10.37,6.91,1.48,4.2,0.49,0,0.74,3.46,5.19,14.57,8.15,4.44,7.16,0.74,13.33,6.42,3.7,1.23,3.7,3.46,2.96,2.72,0.25,0,0,0,7.41,0,0,0,0,13.09,1.48,2.47,2.72,3.7,0.49,3.7,1.48,1.23,0,0,0.25,0,0.25,0,0,13.83,4.94,1.48,5.68,2.22,0.25,0.74,8.89,1.98,11.36,0.99,6.42,4.2,15.31,0.49,0.49,0.49,0,0,1.48,0,1.23,0,0.25,0,15.31,4.94,2.96,1.23,0.25,0.74,0.49,1.23,0,0.99,0.74,1.73
f3vm34,Thoughts on the CS Ed Podcast 2 - Dan Garcia on test creation,,zamansky,2020-02-14 09:36:33,0,12,99,50,74.76,99,12,25,58.33,25,0,0,0,0,0,0,0,0,8.33,16.67,0,0,0,0,0,0,0,0,8.33,0,8.33,8.33,0,0,0,0,0,0,0,0,0,16.67,8.33,8.33,0,0,0,0,0,0,0,0,0,0,0,0,0,8.33,0,8.33,0,0,0,0,0,0,16.67,0,16.67,0,8.33,8.33,0,0,0,0,0,0,0,0,0,0,8.33,0,0,0,0,0,0,8.33,0,0,0,0
f3wkqs,Computer Science Field Trip ideas for Middle/High?,"Hi! I'm a computer science teacher for middle and high school and I want to plan some cool field trips to get the kids to see some cool tech and get them more interested in computers and technology overall. Are there any cool places near NJ/NY that you think would be a great place to take the kids? So far, all I have is the New York Hall of Science. Any suggestions would be great! Thank you!",arturmame,2020-02-14 10:40:34,3,86,79.72,75.74,27.67,99,12.29,12.79,91.86,39.53,8.14,6.98,3.49,0,2.33,0,1.16,1.16,5.81,10.47,9.3,2.33,5.81,0,18.6,13.95,3.49,0,0,6.98,8.14,8.14,0,0,0,0,8.14,0,0,0,0,12.79,2.33,0,3.49,5.81,1.16,0,4.65,1.16,0,3.49,0,0,0,0,0,11.63,1.16,1.16,3.49,5.81,0,0,15.12,1.16,15.12,2.33,11.63,1.16,9.3,0,0,0,0,0,3.49,0,0,3.49,0,0,12.79,2.33,1.16,0,0,2.33,3.49,0,0,1.16,0,2.33
f3wogk,Computer Science Transfer,"I’m currently a freshman at UTRGV and looking to transfer anywhere else next school year (Fall 2020) and my major is CS. What schools would be best to apply to in Texas? Or just any school in general that have a good Computer Science department? 

I have applied to UT Austin and UTD and thinking of applying to UH but not sure",daniel_299,2020-02-14 10:47:08,0,65,69.41,10.93,80.47,95.12,13,24.62,83.08,46.15,7.69,4.62,4.62,0,0,0,0,3.08,3.08,13.85,9.23,3.08,9.23,1.54,12.31,4.62,1.54,1.54,1.54,1.54,4.62,4.62,0,0,0,0,0,0,0,0,0,13.85,1.54,0,1.54,4.62,1.54,6.15,1.54,1.54,0,0,0,0,0,0,0,4.62,0,1.54,3.08,3.08,0,0,9.23,0,15.38,4.62,6.15,4.62,16.92,0,0,0,0,0,1.54,0,0,0,1.54,0,9.23,1.54,0,0,0,3.08,0,0,0,1.54,3.08,0
f4akwi,Innovative Scratch inspired tool to gently introduce students to coding exercises,"I built this when I realised that my students were having trouble solving coding exercises. When I say ""coding exercises"" I mean that I would give them a specification and ask them to write the code to achieve the desired effect. These kinds of exercises can be found on exercises such as leetcode or codewars.

I created this tool as a stepping stone before they can tackle real exercises. Basically, when I give them an exercise, I also tell them which syntactic structures they can use. Instead of writing code, they assemble the structures together like in the Scratch programming system. For many exercises, I make it easier for them by assembling some of the blocks. 

The result is that the student doesn't have to deal with syntax errors and doesn't have to figure out which syntactic patterns they have to use for which problems. I can also make hard problems easier by filling in the gaps.

Also, when I ask them to implement an algorithm, I first have them write out 3 test cases to make sure they understand the algorithm first.

Here's the link: [https://wakata.io/learn/info/wakassemble](https://wakata.io/learn/info/wakassemble)

If you find any bugs or would like to propose any improvements, just send me a DM

About myself: I've been teaching for 3 years at the junior college and bootcamp level. I was the head instructor and curriculum developer at a University based bootcamp for 2 years. Before teaching I was a Google software engineer.",rathereasy,2020-02-15 07:07:53,0,267,67.47,48.5,42.4,68.2,19.07,22.85,81.27,49.44,15.36,11.61,6.74,0,0.37,0,4.49,3.75,7.12,12.73,7.49,4.87,5.99,0.75,15.36,3,2.62,2.62,1.87,1.5,4.49,3.37,1.12,0,0,0,8.61,0,0,0,0,13.11,4.87,3.75,2.25,2.25,0.37,1.87,1.5,0,0.37,1.12,3.37,0.37,3,0,0,6.74,0.75,2.25,2.25,0.75,1.12,2.25,12.36,0,8.61,0.75,4.12,3.75,7.12,3,0,0,0,0,1.12,0,1.12,0,0,0,15.73,5.62,2.62,0.75,0,0,0,0,0.75,1.5,0.75,3.75
f4cni4,Interactice tool to learn HTML/CSS,"How it works: Students have to reproduce an image that I provide using HTML/CSS. I tell them what HTML tags and CSS properties to use. There is a way for them to see the difference between what they have created and what is expected. It was very effective in my classroom.

The interface is similar to codepen. The big difference is that I give specific goals to the student and I tell them what they can use to reach their goal.

Topics covered:

* Standard tags (div, ul, table, etc...)
* Box model
* flexbox and grid
* media queries

Here's the link: [https://wakata.io/learn/info/htmlcss](https://wakata.io/learn/info/htmlcss)

It only works with Chrome.

My students were able to cover all the material in an average of 12 hours of practice. I was able to cover a lot more material and my students were able to learn the material much more deeply as compared as to when I was teaching without this tool.

About myself: I had been teaching for 3 years at the junior college and bootcamp level before I left my job to concentrate on my computer assisted learning platform. I was the head instructor and curriculum developer at a University based bootcamp for 2 years. Before I started teaching I was a Google software engineer.",rathereasy,2020-02-15 09:36:15,0,229,78.21,33.12,52.65,33.3,16.36,21.83,78.17,46.72,14.41,10.04,7.42,0,0,0,2.62,4.37,6.55,13.1,6.99,3.06,4.8,0.44,14.85,5.68,4.37,2.62,1.31,2.62,0.44,0.44,0,0,0,0,4.8,0,0,0,0,10.48,4.8,3.06,0.44,0.44,0.87,1.31,0.87,0.87,0,0,0.44,0.44,0,0,0,8.3,0.44,3.93,3.93,0.87,0,5.24,9.61,0.44,8.3,0,5.24,3.06,11.35,0,0,0,0,0,0.87,0,0.87,0,0,0,19.65,7.42,1.31,1.75,0,0,0,0,0,0.44,1.75,6.99
f4d2cu,"Free PDF booklets: JavaScript coding challenges for CS class, coding clubs and beginners","&amp;#x200B;

[https://www.teacherspayteachers.com/Store/Codeguppy-Coding-For-Kids-And-Teens](https://www.teacherspayteachers.com/Store/Codeguppy-Coding-For-Kids-And-Teens) 

&amp;#x200B;

Tips: Share the entire booklet with your students, or share individual challenges.

&amp;#x200B;

https://preview.redd.it/hnpueu2qn4h41.png?width=1920&amp;format=png&amp;auto=webp&amp;s=be9cc3379812eb56b76ee01454d0bb6e4b625e67

https://preview.redd.it/lmg6ht2qn4h41.png?width=1920&amp;format=png&amp;auto=webp&amp;s=48f353a00db400ed6d343a0dc75110a410347fde",codeobserver,2020-02-15 10:05:01,0,99,91.17,72.77,1,96.96,33,18.18,36.36,12.12,3.03,1.01,0,0,1.01,0,0,2.02,1.01,4.04,0,0,4.04,0,0,1.01,0,0,2.02,1.01,5.05,5.05,0,0,0,0,6.06,0,0,0,0,2.02,0,0,0,1.01,1.01,1.01,0,0,0,0,0,0,0,0,0,8.08,3.03,2.02,3.03,0,0,0,2.02,0,2.02,0,2.02,0,8.08,3.03,0,3.03,0,0,4.04,0,4.04,0,0,0,73.74,11.11,2.02,2.02,12.12,2.02,0,10.1,0,0,2.02,32.32
f5jzlp,100 Days of Leetcode challenge - Data structures,"Yesterday i announced about the leetcode challenge.

Day 1 (Today), i solved and made an article with clear explanations of Top K frequent elements problems 

Consistency in Programming!

https://developersinspired.com/2020/02/17/top-k-frequent-elements/",Meikandanathan,2020-02-17 17:57:05,1,46,97.47,33.19,80.16,66.89,11.5,36.96,65.22,21.74,4.35,4.35,4.35,0,0,0,0,0,4.35,10.87,0,2.17,2.17,0,4.35,10.87,4.35,0,10.87,0,6.52,4.35,2.17,0,0,0,0,0,0,0,0,10.87,4.35,4.35,2.17,0,2.17,0,2.17,2.17,0,0,0,0,0,0,0,13.04,0,10.87,4.35,0,2.17,6.52,2.17,0,19.57,0,6.52,13.04,8.7,0,0,0,0,0,6.52,0,6.52,4.35,0,0,34.78,4.35,2.17,0,0,0,2.17,8.7,0,0,4.35,13.04
f5qhpo,JavaScript interview prep,"I have tried to collate most of the questions in this app - [https://play.google.com/store/apps/details?id=gamesmint.com.jsone](https://play.google.com/store/apps/details?id=gamesmint.com.jsone) (**it is free**). Besides this these links will be very useful

1. Large scale JS architecture - [https://addyosmani.com/largescalejavascript/](https://addyosmani.com/largescalejavascript/) and [https://www.youtube.com/watch?v=b5pFv9NB9fs](https://www.youtube.com/watch?v=b5pFv9NB9fs) (must watch)
2. MVC in native JS - [https://alexatnet.com/model-view-controller-mvc-in-javascript/](https://alexatnet.com/model-view-controller-mvc-in-javascript/)
3. DS &amp; Algo in JS - [https://github.com/trekhleb/javascript-algorithms](https://github.com/trekhleb/javascript-algorithms)
4. [https://stackoverflow.com/questions/17718673/how-is-a-promise-defer-library-implemented](https://stackoverflow.com/questions/17718673/how-is-a-promise-defer-library-implemented) (promise implementation)",GamesMint,2020-02-18 03:37:56,0,158,84.12,50,1.34,94.11,22.57,26.58,46.84,18.35,4.43,1.9,1.9,0,0,0,0,2.53,1.9,5.06,5.7,1.9,1.9,0,6.33,1.9,0.63,1.27,3.8,0.63,4.43,4.43,0,0,0,0,1.9,0,0,0,0,8.86,2.53,2.53,1.27,2.53,2.53,0,3.16,3.16,0,0,0,0,0,0,0,3.8,1.27,0.63,1.9,0,0,0.63,5.06,0.63,4.43,0,4.43,0,1.9,3.8,0,1.9,0,0,9.49,0,9.49,0,0,0,85.44,15.82,0,0,0.63,2.53,0,17.72,0,0,11.39,37.34
f6swty,Curiosity First: Preparing the brain for learning,,dybber,2020-02-20 05:15:28,1,7,99,50,99,25.77,7,42.86,100,28.57,0,0,0,0,0,0,0,0,14.29,14.29,0,0,0,0,14.29,0,0,0,14.29,0,0,0,0,0,0,0,0,0,0,0,0,28.57,28.57,0,0,0,0,0,0,0,0,0,14.29,14.29,0,0,0,14.29,0,14.29,0,0,0,0,0,14.29,14.29,0,0,14.29,14.29,0,0,0,0,0,0,0,0,0,0,0,14.29,0,0,14.29,0,0,0,0,0,0,0,0
f6z91s,What are your top CS related conferences/conventions?,"Looking for recommendations for conferences. Hit me with anything and everything you got.

Which ones have been the most useful?

Most fun?

Worth the ticket price?",tentwelfths,2020-02-20 12:34:14,10,34,59.32,96.11,2.14,98.87,5.67,23.53,91.18,47.06,20.59,8.82,2.94,0,5.88,0,0,11.76,5.88,8.82,8.82,0,2.94,0,17.65,11.76,8.82,5.88,0,5.88,5.88,5.88,0,0,0,0,14.71,0,0,0,0,14.71,2.94,0,0,8.82,2.94,0,2.94,2.94,0,0,0,0,0,0,0,5.88,0,2.94,2.94,2.94,0,5.88,5.88,0,2.94,0,2.94,0,5.88,5.88,0,5.88,0,0,0,0,0,0,0,0,20.59,5.88,0,0,0,11.76,0,0,0,0,0,2.94
f7dut0,CSEd Events in NYC in April/May?,Does anyone know of any CD education-related events that will be going on in New York City in April or May? I will be in the city for a few days (dates TBD) and would like to make it productive.,gaufqwi,2020-02-21 08:49:10,3,48,85.32,50,99,65.25,16,8.33,87.5,52.08,8.33,2.08,2.08,0,0,0,0,6.25,4.17,18.75,16.67,0,4.17,0,22.92,4.17,0,0,0,4.17,2.08,2.08,0,0,0,0,4.17,0,0,0,0,20.83,4.17,4.17,2.08,10.42,0,2.08,0,0,0,0,0,0,0,0,0,2.08,0,0,2.08,0,0,0,10.42,10.42,29.17,2.08,16.67,10.42,4.17,2.08,0,0,0,0,0,0,0,0,0,0,14.58,2.08,0,0,0,4.17,0,2.08,0,0,4.17,2.08
f7ej8h,Did I hinder my son's ability to gain CS skills because of how limited his computer usage was throughout his childhood?,"I'm a father of 2 sons. My older one (20) is in college and has always been the obedient and studious of the two, and has shown demonstrable growth and potential. My younger one (17) however is more of the rebellious and problem child that loves to wrangle out of my control.

At around 11 we found him looking at content not suitable for his age, and since then we've put parental controls and time restrictions on the computer. the doctor also recommended limiting screen time and exposure.

This worked well for a while, but then multiple times he found a way around the filters and kept violating our rules of usage and time. Every time we took it away for a long time and tightened the controls. Everything went well for some time, until I checked the browsing history and found that he had violated the rules again, and was now going on troll sites that aren't good for him.

This was also the time where he got his own computer that I got from my coworker's son who moved away to college, so before giving this to him, we made sure that he couldn't bypass our restrictions. We put Windows controls on it that can't be bypassed, so we can know what he looks up and what sites he goes on. He also must fill out a form that logs his hours, because now there is a zero tolerance policy. 2 a day, no more. He must report everything he does to us, because he's consistently shown he can't be trusted with any privacy or autonomy, so now I've imposed a policy similar to my work; everything must be transparent to the authority, and if there's any pushback or resistance, there will be consequences. His computer is now out in the open so there's peer pressure to stay obedient.

Around this time my son was 16 going on 17, and started to express discontent over our ""draconian"" rules, because the controls often filter sites that are totally safe and locks him out in the middle of games, and when we're away he can't get the password to allow more time. I said that as long as he lives here then he will abide by the rules, and this inconvenience and restriction will teach him not to be so rebellious and deceitful. Plus I'm paying for the internet and electricity, he has no right to complain. And time extensions will not be honored unless it's for homework, but if he wants to learn skills on Khan Academy, he's out of luck, stop playing games then. And there are people in China who are much less fortunate. Even my MIL says I'm right.

Recently this, along with my younger son complaining about ""being deprived of skills when those younger than him are more successful, now he's a NEET and doesn't have any motivation or attention to learn"", along with my older son telling me to let up or he will help him escape, have left me asking if I'm TA.

I think this is just teenage angst, he thinks he's so abused. He can learn everything he wants from the library or at community college.",Lubwach,2020-02-21 09:34:51,9,556,29.23,75.3,31.84,35.18,23.17,17.81,90.11,58.81,17.45,12.41,3.96,1.98,0,6.47,0,5.04,4.86,13.67,10.07,6.47,11.15,1.98,16.91,3.6,3.06,1.44,1.98,2.16,4.14,2.34,1.8,0.18,0.9,0.18,14.39,1.44,0,0,7.73,12.77,2.34,3.06,1.8,2.7,1.98,3.6,0.9,0.54,0.36,0,0.72,0,0.36,0,0.18,12.59,3.06,2.52,5.04,1.62,1.26,4.14,11.33,2.52,16.55,1.8,7.37,7.55,5.04,0.72,0.36,0.18,0,0,0.36,0,0,0,0.36,0,14.75,4.14,4.86,0,0.18,0.18,0,0,0.72,3.96,0.72,0
f7qvlp,Crosspost: wth can this person do? - Deaf Computer Science student - How the hell do I find a job?,,imforit,2020-02-22 02:25:50,1,18,31.3,28.91,4.97,1,9,22.22,88.89,44.44,11.11,5.56,5.56,0,0,0,0,5.56,11.11,0,16.67,5.56,5.56,0,16.67,0,0,5.56,0,0,5.56,0,5.56,0,5.56,0,5.56,0,0,0,0,11.11,5.56,5.56,0,0,0,0,5.56,0,5.56,0,5.56,0,5.56,0,0,5.56,0,0,5.56,0,0,0,22.22,0,0,0,0,0,22.22,0,0,0,5.56,0,5.56,5.56,0,0,0,0,27.78,0,0,5.56,0,11.11,0,11.11,0,0,0,0
f8a4sh,Master in CS Research path,"Hello CSEducation,  I am looking for a master in CS, I have worked for 15+ years in Financial industry as software or data engineer.  The programs I have checked (Canada) almost required research.  Since I am not familiar with academic research, I do need to know the topics before apply?",redditor3900,2020-02-23 06:30:53,3,55,91.4,10.17,66.98,25.77,13.75,25.45,78.18,47.27,9.09,9.09,9.09,0,0,0,0,0,5.45,18.18,9.09,1.82,3.64,1.82,16.36,7.27,3.64,0,1.82,0,0,0,0,0,0,0,1.82,0,0,0,0,10.91,1.82,1.82,1.82,3.64,0,3.64,1.82,1.82,0,0,0,0,0,0,0,7.27,1.82,1.82,3.64,0,0,1.82,12.73,0,10.91,0,5.45,5.45,16.36,0,0,1.82,0,0,0,0,0,0,0,0,16.36,3.64,5.45,0,0,1.82,0,0,0,0,3.64,1.82
f8sl0v,"Read a paper: Effect of self-efficacy, motivation, gender on early programming education",,ggvh,2020-02-24 07:11:47,0,13,99,77.92,94.81,25.77,13,30.77,84.62,23.08,0,0,0,0,0,0,0,0,7.69,15.38,0,0,0,0,7.69,7.69,0,0,0,0,0,0,0,0,0,0,7.69,0,0,0,0,15.38,15.38,15.38,0,0,0,0,0,0,0,0,0,0,0,0,0,15.38,0,7.69,7.69,0,0,0,0,0,15.38,0,7.69,7.69,38.46,0,0,0,0,0,0,0,0,0,0,0,30.77,0,15.38,7.69,0,0,0,7.69,0,0,0,0
f8uskj,Class on building computers (Useful for post secondary studies or a future career?)," I posted this on r/computerscience but I think this is the more appropriate place for it.  

I have a student that wants to help me run a class on building computers this summer for my high school.  He wants to focus on buying cheap parts online (on sale, used, etc.) to get really cheap computers.  He also showed me a curriculum where students learn about the parts and their function.  

First, I think this is an awesome idea! But I want to know how helpful this would be for a future career in computers, partly because I want to make sure I'm offering a class that provides academic or career value to the students and partly so I might have something to tell my principal (who seems to be mostly on board with the idea already.)

I know this could probably help getting computer repair jobs, for a person's own computer, or for a side gig building computers.

But what I'm interested in is if this would be very helpful for someone pursuing computer science, getting an IT job, repairing a company's heavy duty hardware, such as a server, or something else that could help with post secondary or a quality career.",AduroMelior,2020-02-24 09:36:42,14,216,66.94,30.53,39.76,83.41,21.6,20.37,90.28,52.31,15.74,7.87,6.48,0,0,0.93,0.46,7.87,7.87,12.5,6.94,5.09,7.41,0,15.74,4.17,0.93,1.85,0.46,1.39,3.24,3.24,0,0,0,0,6.48,0,0,0,0.93,18.52,3.7,1.85,4.17,6.94,0.46,5.09,0.93,0.46,0,0.46,0,0,0,0,0,7.41,2.31,0.46,4.63,1.39,0,1.85,11.57,2.31,9.26,0.46,5.56,2.31,12.96,0,0,1.85,0,0,0.93,0,0.46,0.46,0,0,14.35,3.7,4.63,0,0,0.46,0.46,0,0,1.85,2.78,0.46
fa1s71,MSc programs in CS - no CS background.,"I have been looking into MSc CS programs for applicants without a CS or Math background (my background is in Economics). I have seen similar posts here but most of the recommended programs are delivered online. I am interested in those taught on campus.

I know of those offered by Imperial College London and UCL.

Any other programs out there that you'd recommend?",thelazarus0,2020-02-26 14:40:21,6,70,64.59,19.58,70.81,52.57,11.67,27.14,80,50,14.29,8.57,7.14,0,1.43,0,0,5.71,2.86,15.71,10,2.86,4.29,2.86,15.71,2.86,2.86,0,0,2.86,1.43,1.43,0,0,0,0,5.71,0,0,0,0,10,1.43,0,0,4.29,0,5.71,2.86,2.86,0,0,0,0,0,0,0,1.43,0,0,1.43,0,0,4.29,8.57,0,10,1.43,8.57,0,14.29,0,0,1.43,0,0,0,0,0,0,0,0,14.29,7.14,0,0,0,1.43,0,1.43,0,1.43,2.86,0
fa3kjd,Hunter Launches CS Teacher Certification Programs,,zamansky,2020-02-26 16:41:59,1,6,93.26,50,23.51,25.77,6,66.67,66.67,0,0,0,0,0,0,0,0,0,0,0,0,0,0,0,0,0,0,0,0,0,0,0,0,0,0,0,0,0,0,0,0,16.67,0,16.67,0,0,0,0,0,0,0,0,0,0,0,0,0,16.67,0,0,16.67,0,0,0,0,0,16.67,16.67,0,0,50,0,0,0,0,0,0,0,0,0,0,0,0,0,0,0,0,0,0,0,0,0,0,0
