fsdcbf,Coding For Kids in Python Part 8,,dailymcoffee,2020-03-31 06:56:59,1,7,99,92.33,13.15,25.77,7,0,57.14,28.57,0,0,0,0,0,0,0,0,0,28.57,0,0,0,0,0,0,0,0,14.29,14.29,0,0,0,0,0,0,14.29,0,0,0,0,0,0,0,0,0,0,0,0,0,0,0,0,0,0,0,0,0,0,0,0,0,0,0,0,0,14.29,0,14.29,0,0,0,0,0,0,0,0,0,0,0,0,0,0,0,0,0,0,0,0,0,0,0,0,0
fsf4yx,Professional educational C# community,"Would you like to discuss anything programming related? Maybe you want to rant about work or studies, share your success or downfalls? Do you have unanswered questions and need help? C# Inn is here for you!  

C# Inn is a 2 years old community with over 4k members. We have a few goals in mind. First, we aim to create a place where developers can freely ask questions, collaborate, learn all while having fun and making friends. It's similar to Stackoverflow.com, but the key difference is that we want to make sure that you understood what we're saying and learn. Arrogance, looking down on others, discrimination for lack of knowledge is not tolerated.  

We also do free code reviews, we have an ongoing large-scale boot camp covering topics like C#, OOP, SOLID, testing, design patterns, client development, web services, security and async programming. Last but not least, we do mock job interviews. 

If you are interested, here is the invitation: https://discord.gg/rCMKcUU",Kaisinell,2020-03-31 08:41:10,0,171,53.05,95.48,8.77,95.42,13.15,24.56,80.7,42.69,11.7,8.19,0,4.09,4.09,0,0,3.51,3.51,8.77,9.36,3.51,6.43,1.17,18.71,4.68,2.34,1.17,1.17,1.75,7.02,5.85,1.17,0,0.58,0,15.2,0,0.58,0,0,16.37,4.09,1.75,3.51,4.09,1.17,5.26,1.17,0.58,0.58,0,0,0,0,0,0,14.04,8.19,2.92,2.34,1.17,1.17,0.58,15.2,0,7.02,0,4.09,2.92,11.11,1.75,0,0.58,0,0,1.17,0,1.17,0,0,0,23.39,5.26,9.94,0.58,0,1.75,0.58,0.58,0,1.17,0,3.51
fsgu4c,Links to Remote Internships/Jobs with Companies that are Actively Hiring,"Since many are losing their internships and even full time job offers due to COVID19, thought this might be an important resource to share with our students: [**https://covidapply.com/**](https://covidapply.com/)",namanpro47,2020-03-31 10:11:40,0,46,84.87,86.15,27.39,93.61,23,23.91,80.43,36.96,8.7,4.35,0,2.17,0,0,2.17,4.35,2.17,13.04,8.7,2.17,2.17,0,15.22,2.17,0,0,0,2.17,8.7,6.52,2.17,0,0,2.17,8.7,0,0,0,0,8.7,4.35,2.17,0,2.17,0,0,0,0,0,0,0,0,0,0,0,10.87,4.35,2.17,4.35,0,2.17,0,8.7,2.17,13.04,0,6.52,6.52,13.04,0,0,0,0,0,4.35,0,4.35,0,0,0,36.96,4.35,2.17,2.17,0,0,0,0,0,0,4.35,23.91
ft9yx1,"Text based programming can be very accessible to young coders. All you need is an environment that embraces the ""Zero boilerplate philosophy"", and they you can let young coders have fun. Perhaps ask them to type-in some code from a printed paper (like in the golden age of microcomputers). Opinions?",,codeobserver,2020-04-01 15:17:59,7,51,85.92,91.49,3.12,62.94,12.75,19.61,78.43,49.02,9.8,7.84,0,0,3.92,0,3.92,1.96,7.84,13.73,11.76,3.92,1.96,0,13.73,5.88,1.96,0,1.96,3.92,1.96,1.96,0,0,0,0,9.8,0,0,0,0,9.8,0,1.96,1.96,3.92,1.96,0,0,0,0,0,1.96,0,0,0,0,3.92,0,0,1.96,1.96,0,0,13.73,0,11.76,0,5.88,5.88,3.92,1.96,0,0,0,0,0,0,0,0,0,0,19.61,5.88,1.96,0,0,1.96,0,1.96,3.92,0,3.92,0
ftkwn5,"Online CPD Course: Metacognition, Metacognitive Strategies &amp; Self-Regulated Learning",,Learning-Power,2020-04-02 04:44:27,0,10,93.26,84.14,3.37,25.77,10,50,50,0,0,0,0,0,0,0,0,0,0,0,0,0,0,0,10,0,0,0,0,0,0,0,0,0,0,0,10,0,0,0,0,10,10,0,0,0,0,0,0,0,0,0,0,0,0,0,0,20,0,10,10,0,0,0,0,0,0,0,0,0,30,0,0,0,0,0,0,0,0,0,0,0,50,0,10,10,10,0,0,10,0,0,0,10
ftl67g,How to Teach Pointers to Students,,CodingOverload,2020-04-02 05:05:20,0,6,93.26,50,1,25.77,6,33.33,83.33,50,0,0,0,0,0,0,0,0,0,33.33,0,16.67,16.67,0,0,0,0,16.67,0,0,0,0,0,0,0,0,0,0,0,0,0,16.67,0,16.67,0,0,0,0,0,0,0,0,0,0,0,0,0,33.33,0,0,33.33,0,0,0,0,0,0,0,0,0,33.33,0,0,0,0,0,0,0,0,0,0,0,0,0,0,0,0,0,0,0,0,0,0,0
ftnu77,A dilemma,"I'm in my 2nd semester of a CS masters program and already, I'm facing a dilemma.

The university does not offer core curriculum over the Summer yet I need 1 Summer course to stay on schedule. That leaves an elective.

Unfortunately,  I'm not particularly enthused about their limited elective offering (due to Summer) either and none really seem to align with my career goals. 

The primary language of the degree is Java.

My choices are:
C# programming &amp; .NET
Intro to python
Intro to robotics
Intro to Parallel Processing

Can anyone advise on what may be the most useful of these choices?",thetrailofthedead,2020-04-02 08:02:11,0,104,84.52,22.08,79.58,43.27,14.86,23.08,77.88,49.04,11.54,7.69,6.73,0,0,0,0.96,3.85,8.65,14.42,8.65,4.81,1.92,2.88,10.58,1.92,1.92,0.96,0.96,2.88,2.88,1.92,0.96,0,0,0,5.77,0,0,0,0,11.54,2.88,0,0.96,3.85,0.96,3.85,0,0,0,0,0,0,0,0,0,4.81,0,1.92,1.92,1.92,0,0.96,10.58,0.96,13.46,1.92,4.81,7.69,10.58,0,0,0,0,0,0,0,0,0,0,0,17.31,5.77,1.92,0.96,0.96,0.96,0,0,0,2.88,1.92,1.92
ftx9aq,🖨 I'm preparing a FREE book (PDF format) with 30 listings of small programs that can be typed-in by kids with no prior coding experience. As a parent / instructor you just have to print the book and ask kids to type-in the program. The book will be hosted in the Downloads section of codeguppy.com,,codeobserver,2020-04-02 16:40:34,0,56,97.73,76.25,7.84,59.59,18.67,16.07,80.36,50,5.36,3.57,1.79,0,1.79,0,0,1.79,10.71,19.64,10.71,1.79,3.57,1.79,12.5,5.36,1.79,0,1.79,1.79,1.79,1.79,0,0,0,0,8.93,1.79,0,0,0,0,0,0,0,0,0,0,1.79,0,0,0,0,0,0,0,0,3.57,1.79,0,1.79,0,0,3.57,10.71,3.57,10.71,0,8.93,1.79,12.5,5.36,0,1.79,0,0,0,0,0,0,0,0,16.07,5.36,0,0,0,0,0,3.57,0,1.79,3.57,1.79
ftzsiy,9+ Remote Job/Internship Websites That Might Help,"**During my remote jobs search here are a few that I tried:**

&amp;#x200B;

1. WeWorkRemotely: [https://weworkremotely.com/](https://weworkremotely.com/)  
 
2. Remotists: [https://remotists.substack.com/](https://remotists.substack.com/)  
 
3. Working Nomads: [https://www.workingnomads.co/jobs](https://www.workingnomads.co/jobs)  
 
4. Remotive: [https://remotive.io/](https://remotive.io/)  
 
5. NoDesk: [https://nodesk.co/remote-jobs/](https://nodesk.co/remote-jobs/)  
 
6. RemoteLeaf: [https://remoteleaf.com/](https://remoteleaf.com/)  
 
7. Remote: [https://remote.com/remote-jobs](https://remote.com/remote-jobs)  
 
8. Wellpaid: [https://wellpaid.io/](https://wellpaid.io/)  
 
9. DesignModo: [https://designmodo.com/jobs](https://designmodo.com/jobs)  
 
10. RemoteOk: [https://remoteok.io/](https://remoteok.io/)  
 

Hope this helps :)",santasnemesis,2020-04-02 19:20:46,2,143,88.42,50,6.46,65.52,11.92,19.58,44.06,6.99,3.5,1.4,1.4,0,0,0,0,2.1,0.7,0.7,1.4,0.7,0,0,4.2,0.7,0,0,7.69,0.7,2.1,2.1,0,0,0,0,1.4,0,0,0,0,1.4,0,0,0.7,1.4,0,0,0.7,0.7,0,0,0,0,0,0,0,2.8,1.4,1.4,0.7,0,0,0.7,2.1,1.4,11.19,0,10.49,0.7,7.69,0,0,0,0,0,14.69,0,14.69,0,0,0,98.6,23.78,0,7.69,1.4,0,0,2.8,0,0,13.99,48.95
funs2w,Job Cuts have Started. Are You Prepared?,"Today while researching for my remote jobs newsletter, I saw the status on two companies job board change in a span of 2 hours.

It went from open hiring to hiring freeze until May 31st.

This is really sad. The situation is no nimble that I find it really hard to push towards any direction at this point.

Just a month earlier, I had a consulting gig that paid decent and revenue from offline events and workshops. But now the situation has flipped on its head, I lost my consulting client because their funding round was postponed indefinitely and my offline events have all been cancelled.

It has become a struggle now.

Just like me there are a lots of them who have had their life change drastically and it is sad to think that there is no real hope on the horizon.

If you are someone who is going through something like this, just keep trying to survive. I know it is hard, but it should be done.

If you know someone who is impacted by this, give them your support.",santasnemesis,2020-04-03 22:03:08,3,189,29.3,56.31,54.6,18.01,14.54,16.93,89.42,58.73,19.58,8.99,4.76,0,2.12,0,2.12,10.58,4.76,10.58,12.7,4.76,5.82,1.06,22.75,3.17,1.59,1.59,1.06,1.59,3.7,1.59,2.12,0.53,0,1.59,8.47,0,0,0,0,13.23,2.65,1.59,2.12,5.82,0.53,3.17,2.65,1.06,0,2.12,1.06,0.53,0.53,0,0,2.65,0,1.59,1.06,0,0,5.82,15.34,2.12,13.23,2.65,5.82,4.76,5.82,0,0,1.59,0,0,0,0,0,0,0,0,10.05,6.35,3.17,0,0,0.53,0,0,0,0,0,0
fuwtef,"Programs for the ""Draw with code"" book are ready. If you want to beta test them with kids, please contact me at @codeguppy on Twitter and I'll send them to you.",,codeobserver,2020-04-04 09:42:38,0,31,84.99,98.75,8.87,99,15.5,12.9,87.1,54.84,19.35,19.35,6.45,0,6.45,0,6.45,0,3.23,22.58,6.45,0,6.45,0,12.9,0,0,0,0,0,6.45,6.45,0,0,0,0,25.81,0,3.23,0,0,6.45,0,0,6.45,3.23,0,3.23,0,0,0,0,0,0,0,0,0,3.23,3.23,0,0,0,0,0,9.68,3.23,9.68,3.23,6.45,0,9.68,6.45,0,0,0,0,3.23,0,3.23,0,0,0,22.58,6.45,3.23,0,0,0,0,0,6.45,3.23,0,3.23
fv89fz,Day 32 of 100 days of Leetcode Challenge - Reverse Substrings Between Each Pair of Parentheses,,Meikandanathan,2020-04-04 22:00:27,0,15,99,74.76,10.08,99,15,40,60,26.67,0,0,0,0,0,0,0,0,0,26.67,0,0,0,0,0,0,0,0,13.33,6.67,6.67,6.67,0,0,0,0,6.67,6.67,0,0,0,0,0,0,0,0,0,0,0,0,0,0,0,0,0,0,0,13.33,6.67,6.67,0,0,0,0,0,0,13.33,0,0,13.33,6.67,0,0,0,0,0,0,0,0,0,0,0,6.67,0,0,0,0,0,0,6.67,0,0,0,0
fv8z2w,Scratch Tutorial for making 2D Minecraft,,jabela,2020-04-04 23:00:22,0,6,99,50,1,25.77,6,50,66.67,16.67,0,0,0,0,0,0,0,0,0,16.67,0,0,0,0,16.67,0,0,0,0,0,0,0,0,0,0,0,0,0,0,0,0,16.67,0,16.67,0,0,0,0,16.67,0,0,16.67,0,0,0,0,0,0,0,0,0,0,0,0,0,0,0,0,0,0,16.67,0,0,0,0,0,0,0,0,0,0,0,0,0,0,0,0,0,0,0,0,0,0,0
fveggn,Binary representation basicd,"This community was really supportive of my last efforts, so I thought I'd share my latest!
As a computer science teacher, I'm currently having to work my way through the myriad of ways to keep educating my pupils.
I've been toying with the idea of making videos to keep my pupils up to speed. 
If you've got any ideas or suggestions, let me know!

[binary essentials playlist](https://www.youtube.com/playlist?list=PL2mSc20yMLycXGfmB5LOgAnOX5UsLN6h2)",scudango,2020-04-05 07:26:08,2,78,65.46,15.25,88.5,73.64,13,21.79,78.21,43.59,15.38,14.1,12.82,0,1.28,0,0,1.28,3.85,14.1,10.26,2.56,5.13,0,17.95,3.85,2.56,0,0,1.28,2.56,2.56,0,0,0,0,5.13,0,0,0,0,11.54,5.13,1.28,1.28,3.85,0,3.85,1.28,1.28,0,0,0,0,0,0,0,8.97,2.56,2.56,2.56,1.28,0,5.13,10.26,0,7.69,0,2.56,5.13,6.41,3.85,0,0,0,0,1.28,0,1.28,0,0,0,26.92,5.13,3.85,0,0,1.28,2.56,0,0,5.13,2.56,6.41
fvuyi6,Find Largest Value in each Tree Row -Day 30 Leetcode challenge of 100,,Meikandanathan,2020-04-06 01:22:05,0,13,99,50,94.81,99,13,23.08,61.54,15.38,0,0,0,0,0,0,0,0,0,15.38,0,0,0,0,7.69,7.69,7.69,0,15.38,7.69,15.38,15.38,0,0,0,0,0,0,0,0,0,7.69,7.69,0,0,0,0,0,0,0,0,0,0,0,0,0,0,15.38,0,7.69,7.69,0,0,0,7.69,0,23.08,0,15.38,7.69,7.69,0,0,0,0,0,0,0,0,0,0,0,7.69,0,0,0,0,0,0,7.69,0,0,0,0
fvzz80,Group Anagrams Leetcode 6th day programming challenge in C#,,Meikandanathan,2020-04-06 07:46:01,0,9,98.87,86.68,58.07,99,9,44.44,55.56,11.11,0,0,0,0,0,0,0,0,0,11.11,0,0,0,0,0,0,0,0,0,11.11,11.11,11.11,0,0,0,0,11.11,0,0,0,0,0,0,0,0,0,0,0,0,0,0,0,0,0,0,0,0,22.22,11.11,11.11,0,0,0,0,0,0,22.22,0,11.11,11.11,22.22,0,0,0,0,0,0,0,0,0,0,0,11.11,0,0,0,0,0,0,0,0,0,0,11.11
fw3ole,"Free coding tutorials for K-6. New projects every week, and a library of coding storybooks and games for kids to work through!",,speakerjam,2020-04-06 11:07:07,0,23,99,80.77,2.02,93.61,11.5,21.74,82.61,34.78,0,0,0,0,0,0,0,0,4.35,21.74,0,0,8.7,0,0,8.7,0,0,4.35,4.35,4.35,4.35,0,0,0,0,8.7,0,0,0,0,4.35,0,0,0,0,4.35,0,0,0,0,0,0,0,0,0,0,8.7,4.35,4.35,0,0,0,0,4.35,0,8.7,0,0,8.7,17.39,4.35,0,4.35,0,0,4.35,0,4.35,4.35,0,0,17.39,4.35,4.35,0,0,0,4.35,4.35,0,0,0,0
fw52sl,Learn to Build for the Web - Upcoming Live Streams,"Hey everyone!

I hope you all are doing well and staying safe.

Just wanted to give you a heads up on some upcoming livestreams - ""All About Building for the Web""

[https://www.webofficehours.com/#sessions](https://www.webofficehours.com/#sessions)

As a reminder, WebOfficeHours is a place where we host experienced web developers, designers, builders, etc as they share their expertise via a livestream. Our goal is to give you more tools and inspiration to build for the web. 🙂

Paul",pberesuita,2020-04-06 12:22:08,0,91,92.18,96.06,1.4,98.16,15.17,21.98,71.43,41.76,9.89,8.79,1.1,2.2,3.3,0,2.2,1.1,7.69,14.29,4.4,4.4,4.4,0,12.09,4.4,3.3,1.1,0,4.4,5.49,5.49,0,0,0,0,13.19,0,0,0,0,8.79,2.2,0,2.2,2.2,3.3,0,1.1,0,0,0,2.2,1.1,1.1,0,0,7.69,3.3,1.1,2.2,1.1,1.1,1.1,9.89,3.3,6.59,1.1,6.59,0,5.49,0,0,0,0,0,4.4,0,2.2,0,1.1,0,28.57,7.69,4.4,0,0,0,1.1,2.2,2.2,0,2.2,8.79
fw5wv9,Live Online Coding Clubs With an Instructor (Ages 9 to 16) - FREE for the first 2 sessions,,geekygirlhere,2020-04-06 13:05:25,0,17,99,50,6.2,98.87,17,11.76,70.59,29.41,0,0,0,0,0,0,0,0,11.76,17.65,0,0,0,0,5.88,5.88,0,0,23.53,0,5.88,5.88,0,0,0,0,0,0,0,0,0,0,0,0,0,0,0,0,0,0,0,0,5.88,0,5.88,0,0,11.76,5.88,5.88,0,0,0,0,5.88,0,11.76,0,0,11.76,11.76,5.88,0,5.88,0,0,0,0,0,0,0,0,17.65,0,0,0,0,0,0,5.88,0,0,11.76,0
fxlyl1,Determine Path in Binary Tree - Leetcode Challenge - Explanation,,Meikandanathan,2020-04-08 21:40:15,0,8,99,50,99,99,8,50,50,12.5,0,0,0,0,0,0,0,0,0,12.5,0,0,0,0,12.5,0,0,0,0,0,12.5,12.5,0,0,0,0,0,0,0,0,0,25,25,0,0,0,0,0,0,0,0,0,0,0,0,0,0,12.5,0,12.5,0,0,0,0,12.5,0,12.5,0,12.5,0,12.5,0,0,0,0,0,0,0,0,0,0,0,25,0,0,0,0,0,0,25,0,0,0,0
fy3iok,Live online coding classes for ages 7-18,,ss_ednora,2020-04-09 16:52:32,2,8,99,50,7.84,25.77,8,12.5,50,12.5,0,0,0,0,0,0,0,0,0,12.5,0,0,0,0,12.5,0,0,0,25,0,0,0,0,0,0,0,0,0,0,0,0,0,0,0,0,0,0,0,0,0,0,0,12.5,0,12.5,0,0,0,0,0,0,0,0,0,12.5,0,12.5,0,0,12.5,12.5,0,0,0,0,0,0,0,0,0,0,0,12.5,0,0,0,0,0,0,12.5,0,0,0,0
fyjl4k,"Min Stack - Push(), Pop(), Top(), GetMin() - All operations in O(1) time - I really loved this approach",,Meikandanathan,2020-04-10 09:53:28,7,17,74.42,27.83,99,98.87,17,11.76,76.47,23.53,11.76,5.88,5.88,0,0,0,0,5.88,0,5.88,0,5.88,0,0,5.88,5.88,5.88,0,5.88,5.88,5.88,5.88,0,0,0,0,5.88,0,0,0,0,11.76,0,0,0,0,5.88,5.88,0,0,0,0,11.76,0,5.88,0,0,17.65,5.88,5.88,5.88,5.88,0,0,0,0,35.29,11.76,11.76,11.76,5.88,0,0,0,0,0,5.88,0,5.88,0,0,0,94.12,0,17.65,0,0,0,0,17.65,0,0,58.82,0
fyl87d,Recommendations for online master programs in Data Science,"Hello,

Any recommendations for good online master programs in Data Science that don't cost an arm and a leg, and that are open to applicants without a background in CS or math?  

Thanks in advance.",thelazarus0,2020-04-10 11:13:47,3,43,96.6,40.82,34.47,95.29,14.33,23.26,86.05,41.86,4.65,0,0,0,0,0,0,4.65,6.98,18.6,4.65,0,6.98,4.65,9.3,0,0,0,0,2.33,4.65,4.65,0,0,0,0,6.98,0,0,0,0,6.98,0,0,0,4.65,0,4.65,0,0,0,0,4.65,4.65,0,0,0,11.63,2.33,2.33,4.65,4.65,0,0,9.3,0,13.95,2.33,11.63,0,13.95,0,0,2.33,0,0,0,0,0,0,0,0,11.63,2.33,4.65,0,0,2.33,0,0,0,2.33,0,0
fz0zit,A modern BASIC-like teaching and learning programming language,,chkas,2020-04-11 02:20:24,10,9,98.87,86.68,58.07,25.77,9,44.44,100,33.33,0,0,0,0,0,0,0,0,11.11,11.11,0,0,11.11,0,11.11,22.22,11.11,0,0,0,0,0,0,0,0,0,11.11,0,0,0,0,11.11,11.11,0,0,0,0,0,0,0,0,0,0,0,0,0,0,11.11,0,0,11.11,0,0,0,0,0,11.11,0,0,11.11,33.33,0,0,0,0,0,0,0,0,0,0,0,11.11,0,0,0,0,0,0,11.11,0,0,0,0
fz337s,Free Computer Science Teaching Resources,,CodingOverload,2020-04-11 04:27:08,0,5,93.26,50,1,99,5,80,100,0,0,0,0,0,0,0,0,0,0,0,0,0,0,0,0,20,0,0,0,0,20,20,0,0,0,0,0,0,0,0,0,0,0,0,0,0,0,0,0,0,0,0,0,0,0,0,0,20,0,0,20,0,0,0,0,0,0,0,0,0,80,0,0,20,0,0,0,0,0,0,0,0,0,0,0,0,0,0,0,0,0,0,0,0
fz4ogh,How to find the Height and Diameter of the Binary Tree - Code walkthrough- easy to understand,,Meikandanathan,2020-04-11 05:56:59,0,16,99,50,35.37,99,16,18.75,68.75,43.75,0,0,0,0,0,0,0,0,12.5,18.75,0,6.25,12.5,0,12.5,6.25,0,6.25,0,0,6.25,6.25,0,0,0,0,0,0,0,0,0,18.75,12.5,6.25,0,0,0,0,0,0,0,0,0,0,0,0,0,0,0,0,0,0,0,0,12.5,0,6.25,0,6.25,0,0,0,0,0,0,0,0,0,0,0,0,0,12.5,0,0,0,0,0,0,12.5,0,0,0,0
fzbwqa,Online Education Webinars For Teachers &amp; Students,,amnews247,2020-04-11 10:59:58,0,7,99,50,1,25.77,7,57.14,57.14,14.29,0,0,0,0,0,0,0,0,0,14.29,0,0,0,0,0,0,0,0,0,0,0,0,0,0,0,0,0,0,0,0,0,0,0,0,0,0,0,0,0,0,0,0,0,0,0,0,0,42.86,0,0,42.86,0,0,0,0,0,0,0,0,0,42.86,0,0,0,0,0,0,0,0,0,0,0,28.57,0,0,0,14.29,0,0,0,0,0,0,14.29
fzkbg8,"Learn to program by making hip hop beats (online camp for 11-15 yr olds, need help finding participants)",,davidshepherd,2020-04-11 15:17:20,0,19,99,85.38,4.05,25.77,19,15.79,68.42,15.79,0,0,0,0,0,0,0,0,0,15.79,0,0,0,0,15.79,0,0,0,10.53,0,0,0,0,0,0,0,10.53,0,0,0,0,21.05,10.53,5.26,5.26,0,0,0,0,0,0,0,5.26,5.26,0,0,0,10.53,5.26,0,10.53,0,0,0,10.53,0,5.26,5.26,0,0,10.53,0,0,0,0,0,0,0,0,0,0,0,21.05,0,5.26,0,0,0,0,5.26,0,0,10.53,0
fzq17v,Day 44 0f 100 Days of Leetcode Programming Challenge with solutions - Find Bottom Left Tree Value,,Meikandanathan,2020-04-11 21:27:43,0,16,99,50,99,99,16,25,68.75,12.5,0,0,0,0,0,0,0,0,0,12.5,0,0,0,0,12.5,6.25,6.25,0,12.5,0,12.5,12.5,0,0,0,0,0,0,0,0,0,12.5,12.5,6.25,0,0,0,0,0,0,0,0,0,0,0,0,0,18.75,0,12.5,6.25,0,0,6.25,6.25,0,25,0,12.5,12.5,12.5,0,0,0,0,0,0,0,0,0,0,0,6.25,0,0,0,0,0,0,6.25,0,0,0,0
fztnow,"Got hold of older computer, would like to use it for *Linux education","Hello, I recently got hold of an *older computer and I was thinking about ways to use it for *Linux (or BSD or whatever) education in a fully Microsoft environment.

I currently cooperate with an elementary school though I don't teach there. My idea was to put the computer on network and enable both local access and remote access (e.g. from home).

However my main struggle is in how to get kids interested in these kind of technologies without having direct influence on the teached subjects.

Also what could I suggest to the teachers in CS class considering they're not advanced users nor do any programming or such?

I was not able to find any advantages over Windows in respect to teached office skills. The children are in the age of 10-15.

Does anyone have experience with something similar?",asmarCZ,2020-04-12 02:21:07,1,152,74.24,14.62,84.04,63.19,16.89,24.34,89.47,51.32,9.87,5.26,5.26,0,0,0,0,4.61,5.26,17.11,8.55,5.26,7.24,3.29,14.47,2.63,2.63,1.97,1.32,1.97,3.29,2.63,0.66,0.66,0,0,3.95,0,0,0,0,16.45,2.63,3.29,1.32,5.26,0,5.92,0.66,0,0,0,0,0,0,0,0,15.79,1.32,3.29,7.89,4.61,0,3.29,7.89,0,14.47,1.32,9.87,3.29,9.87,0,1.32,0,0,0,0,0,0,0,0,0,14.47,5.26,1.32,0,0,1.32,0,0.66,0,1.32,2.63,1.97
fzzanz,CS Major Requirements,"

Hey guys,

I’m a High School sophomore that just got into computer science. I want to know what extracurriculars, gpa, sat, and etc you did in order to get into an good engineering school.",BigMohammad,2020-04-12 09:03:20,11,37,86.66,70.57,54.14,75.85,12.33,16.22,86.49,40.54,13.51,8.11,5.41,0,2.7,0,0,5.41,5.41,13.51,5.41,2.7,2.7,0,18.92,2.7,0,2.7,0,0,2.7,2.7,0,0,0,0,8.11,0,2.7,0,2.7,5.41,2.7,0,2.7,0,0,0,0,0,0,0,0,0,0,0,0,16.22,0,2.7,5.41,8.11,0,8.11,10.81,0,16.22,0,10.81,2.7,18.92,0,0,0,0,0,2.7,0,0,0,0,0,18.92,5.41,10.81,0,0,0,0,0,0,2.7,0,0
g00b7g,Free online education in C++ Machine Learning and Java Introduction,"I've found this resource and would like to share free online education in C++ and Java. Gerard explains well the concepts and has several motivational career videos.

[https://www.youtube.com/watch?v=E1K9SZCm0fQ&amp;t=2178s](https://www.youtube.com/watch?v=E1K9SZCm0fQ&amp;t=2178s)",chickentendies_UwU,2020-04-12 09:57:50,0,59,77.94,56.74,3.58,99,14.75,25.42,55.93,22.03,3.39,1.69,1.69,0,0,0,0,1.69,1.69,5.08,5.08,1.69,6.78,0,10.17,3.39,0,0,0,1.69,8.47,8.47,0,0,0,0,3.39,0,0,0,0,8.47,6.78,1.69,1.69,0,0,0,5.08,5.08,0,0,0,0,0,0,0,6.78,1.69,1.69,3.39,0,0,1.69,10.17,0,3.39,0,3.39,0,10.17,5.08,0,3.39,0,0,5.08,0,3.39,0,1.69,0,49.15,10.17,0,0,3.39,3.39,0,0,0,1.69,3.39,27.12
g0mg6f,Contiguous Array - Day 12 of Leetcode Challenge today - Explanations and Code walkthrough with Efficient Solution,,Meikandanathan,2020-04-13 09:36:25,1,15,97.53,50,82.75,99,15,46.67,60,20,0,0,0,0,0,0,0,0,0,13.33,0,0,6.67,0,0,0,0,0,6.67,0,6.67,6.67,0,0,0,0,0,0,0,0,0,13.33,13.33,6.67,0,0,0,0,0,0,0,0,0,0,0,0,0,20,0,20,0,0,0,0,6.67,0,13.33,0,0,13.33,6.67,0,0,0,0,0,0,0,0,0,0,0,13.33,0,0,0,0,0,0,13.33,0,0,0,0
g0om20,Affordable online computer science education Masters,"Hi All, I am a certified math teacher in the US. What would you recommend as a good masters degree, online in computer science education, that is also affordable?",TheBerensteinBear,2020-04-13 11:25:40,1,35,68.29,92.33,1,78.19,11.67,37.14,91.43,42.86,14.29,8.57,2.86,2.86,2.86,0,0,5.71,8.57,8.57,8.57,2.86,5.71,0,8.57,8.57,2.86,2.86,0,2.86,2.86,2.86,0,0,0,0,11.43,0,0,0,0,5.71,0,0,2.86,0,2.86,0,0,0,0,0,0,0,0,0,0,22.86,5.71,0,14.29,2.86,0,0,5.71,0,5.71,0,5.71,0,31.43,0,0,5.71,0,0,0,0,0,0,0,0,14.29,2.86,8.57,0,0,2.86,0,0,0,0,0,0
g0sddn,John Conway,,zamansky,2020-04-13 14:45:30,0,2,93.26,50,1,25.77,2,0,0,0,0,0,0,0,0,0,0,0,0,0,0,0,0,0,0,0,0,0,0,0,0,0,0,0,0,0,0,0,0,0,0,0,0,0,0,0,0,0,0,0,0,0,0,0,0,0,0,0,0,0,0,0,0,0,0,0,0,0,0,0,0,0,0,0,0,0,0,0,0,0,0,0,0,0,0,0,0,0,0,0,0,0,0,0
g0tvh0,Essential Remote Learning Tools for Higher Ed | The EduTech Post,,edutechpost,2020-04-13 16:08:28,0,10,99,50,99,25.77,10,30,70,20,0,0,0,0,0,0,0,0,10,10,0,0,0,0,10,20,10,0,0,0,0,0,0,0,0,0,0,0,0,0,0,20,10,0,0,0,10,0,0,0,0,0,0,0,0,0,0,10,0,0,10,0,0,0,0,0,30,0,20,0,10,0,0,0,0,0,0,0,0,0,0,0,10,0,0,0,0,0,0,0,0,0,0,10
g109dj,Sum Root to Leaf Numbers - Day 46 of 100 Days of Programming - With Efficient Solution and explanation,,Meikandanathan,2020-04-13 23:19:48,0,17,99,50,66.34,25.77,17,29.41,70.59,29.41,0,0,0,0,0,0,0,0,0,23.53,0,0,5.88,0,0,0,0,0,11.76,0,0,0,0,0,0,0,0,0,0,0,0,17.65,11.76,11.76,0,0,0,0,0,0,0,0,0,0,0,0,0,11.76,0,11.76,0,0,0,0,0,0,11.76,0,0,11.76,5.88,0,0,0,0,0,0,0,0,0,0,0,11.76,0,0,0,0,0,0,11.76,0,0,0,0
g112pk,Web Designer Diploma,,redsenu,2020-04-14 00:26:09,0,3,93.26,50,1,25.77,3,66.67,33.33,0,0,0,0,0,0,0,0,0,0,0,0,0,0,0,0,0,0,0,0,0,0,0,0,0,0,0,0,0,0,0,0,0,0,0,0,0,0,0,0,0,0,0,0,0,0,0,0,0,0,0,0,0,0,0,0,0,0,0,0,0,33.33,0,0,0,0,0,0,0,0,0,0,0,0,0,0,0,0,0,0,0,0,0,0,0
g12lal,Leetcode Day 14 Challenge Today - Perform String Shifts - Efficient Solution with Code walkthrough,,Meikandanathan,2020-04-14 02:41:58,0,13,97.95,50,63.54,99,13,46.15,53.85,7.69,0,0,0,0,0,0,0,0,0,7.69,0,0,0,0,0,0,0,0,7.69,0,7.69,7.69,0,0,0,0,0,0,0,0,0,7.69,7.69,7.69,0,0,0,0,0,0,0,0,0,0,0,0,0,23.08,0,23.08,0,0,0,0,7.69,0,15.38,0,0,15.38,15.38,0,0,0,0,0,0,0,0,0,0,0,15.38,0,0,0,0,0,0,15.38,0,0,0,0
g1bnxt,Building Accessible Components Live Stream Soon,"Hey Everyone,

I hope everyone is continuing to hang in there while practicing social distancing!

I would like to invite you all to join yet ANOTHER exciting WebOfficeHours Zoom session! The topic will be “Building Accessible Components” presented by our fantastic guest, Jemima Abu. This talk will focus on the use of Semantic HTML, managing user interaction, and much more.

The Zoom session will begin at 4PM ET today! (1 hour from now)

Join us below

[https://devexi.zoom.us/j/4098201923](https://devexi.zoom.us/j/4098201923)",pberesuita,2020-04-14 12:05:53,1,96,77.41,94.08,29.15,92.4,13.71,22.92,71.88,37.5,11.46,7.29,2.08,4.17,1.04,0,0,4.17,3.12,10.42,6.25,4.17,2.08,0,14.58,3.12,1.04,0,3.12,4.17,4.17,4.17,0,0,0,0,12.5,0,1.04,0,0,6.25,0,1.04,2.08,1.04,3.12,0,0,0,0,0,1.04,0,1.04,0,0,14.58,8.33,1.04,2.08,3.12,0,0,12.5,5.21,17.71,5.21,5.21,7.29,4.17,0,0,0,0,0,3.12,0,2.08,0,0,0,28.12,6.25,4.17,0,0,0,3.12,0,2.08,0,4.17,8.33
g1oi6g,Create your stunning website on WordPress.com,,redsenu,2020-04-15 02:12:18,0,7,93.26,99,13.15,99,7,42.86,42.86,28.57,14.29,14.29,0,0,14.29,0,0,0,0,14.29,0,0,0,0,14.29,0,0,0,0,0,14.29,14.29,0,0,0,0,14.29,0,0,0,0,14.29,0,14.29,0,0,0,0,0,0,0,0,0,0,0,0,0,14.29,0,14.29,0,0,0,0,0,0,14.29,0,14.29,0,0,0,0,0,0,0,0,0,0,0,0,0,14.29,14.29,0,0,0,0,0,0,0,0,0,0
g1ojx9,WooCommerce - eCommerce for WordPress,,redsenu,2020-04-15 02:16:27,1,4,99,50,1,25.77,4,75,25,25,0,0,0,0,0,0,0,0,0,25,0,0,0,0,0,0,0,0,0,0,0,0,0,0,0,0,0,0,0,0,0,0,0,0,0,0,0,0,0,0,0,0,0,0,0,0,0,0,0,0,0,0,0,0,0,0,0,0,0,0,0,0,0,0,0,0,0,0,0,0,0,0,25,0,0,0,0,0,0,25,0,0,0,0
g1rnic,Varying Remote Teaching,,zamansky,2020-04-15 06:12:56,4,3,93.26,50,98.01,25.77,3,66.67,66.67,0,0,0,0,0,0,0,0,0,0,0,0,0,0,0,0,0,0,0,0,0,0,0,0,0,0,0,0,0,0,0,0,0,0,0,0,0,0,0,0,0,0,0,0,0,0,0,0,33.33,0,0,33.33,0,0,0,0,0,33.33,0,33.33,0,33.33,0,0,0,0,0,0,0,0,0,0,0,0,0,0,0,0,0,0,0,0,0,0,0
g1x8vx,Coding For Kids in Python Part 9 is Out,"Check out the new video in this series which was published today. 

In this video, you learn about all the List Operations in Python.

[Coding for Kids in Python Part 9](https://www.youtube.com/watch?v=RoUvHNujdro)",dailymcoffee,2020-04-15 11:05:48,0,48,98.69,79.76,48.89,25.77,12,8.33,70.83,37.5,8.33,2.08,0,0,2.08,0,0,6.25,4.17,20.83,4.17,2.08,0,0,6.25,2.08,0,2.08,4.17,8.33,0,0,0,0,0,0,6.25,0,0,0,0,4.17,2.08,0,0,0,2.08,0,6.25,6.25,0,0,2.08,0,2.08,0,0,0,0,0,0,0,0,2.08,8.33,0,18.75,0,14.58,4.17,6.25,6.25,0,0,0,0,2.08,0,2.08,0,0,0,27.08,8.33,2.08,0,0,2.08,0,0,0,0,4.17,10.42
g27z79,CS college student looking for project ideas,"
Hello all!
I am currently finishing up my first year of CS courses at a CC in northern Cal. I’m looking to begin out of class projects to start building my resume, but mainly for overall practice. Was wondering if anyone had any good ideas, topics or experiences they’d like to share. What type of projects would look best on resumes? How have projects, or lack of projects, affected your internship and job opportunities? 

Much appreciated!",transferstudent144,2020-04-15 21:23:20,12,83,83.65,45.21,76.33,99,10.38,27.71,91.57,42.17,9.64,7.23,4.82,0,1.2,0,1.2,2.41,1.2,18.07,8.43,1.2,7.23,0,19.28,1.2,2.41,2.41,1.2,3.61,6.02,6.02,0,0,0,0,7.23,0,0,0,0,20.48,4.82,2.41,3.61,9.64,1.2,4.82,4.82,3.61,0,0,0,0,0,0,0,12.05,2.41,4.82,3.61,3.61,1.2,3.61,12.05,0,14.46,0,7.23,7.23,15.66,0,0,0,0,0,1.2,0,1.2,0,0,0,15.66,3.61,4.82,0,0,2.41,2.41,0,0,2.41,0,0
g2ju0j,Univs offering online core CS courses for academic credit,[deleted],[deleted],2020-04-16 10:51:15,0,10,98.58,84.14,1,99,5,40,60,10,0,0,0,0,0,0,0,0,0,10,0,0,0,0,10,10,0,0,0,0,10,10,0,0,0,0,10,0,0,0,0,0,0,0,0,0,0,0,0,0,0,0,0,0,0,0,0,0,0,0,0,0,0,10,0,0,0,0,0,0,30,0,0,10,0,0,0,0,0,0,0,0,20,0,0,0,0,0,0,0,0,0,0,20
