fahc4k,Presenting at HS Career Day -- ideas?,"I'm a software developer and have volunteered to give a 30-minute presentation to a high school classroom for their Career Day.  I have substantial teaching experience, and I'm wondering if anyone has some ideas about what to do during this presentation.  I'd like to avoid just standing up there and talking, but I'm going in with the assumption that they will not have computers in front of them, and have limited programming experience.  FWIW, my experience is in Ruby/Rails, Python/Django, and Javascript/React.  Any suggestions?",thumbtackthief,2020-02-27 11:24:11,7,94,58.1,37.48,77.49,11.87,15.67,22.34,87.23,53.19,13.83,9.57,6.38,0,0,0,3.19,4.26,4.26,15.96,12.77,3.19,7.45,1.06,17.02,1.06,1.06,1.06,1.06,2.13,1.06,0,1.06,1.06,0,0,7.45,0,0,0,0,11.7,4.26,1.06,1.06,6.38,0,3.19,4.26,0,1.06,0,0,0,0,0,0,5.32,0,1.06,3.19,0,1.06,0,11.7,2.13,12.77,1.06,7.45,4.26,10.64,1.06,0,0,0,0,0,0,0,0,0,0,23.4,4.26,6.38,0,0,2.13,0,3.19,0,4.26,0,3.19
fawfey,What degree should I pursue?,"Guys I’m very confused atm, i will be joining college in fall this year, i am confused to decide my major. I am thinking of Either computer science from arguably number 1 university of my country or I do BS ECONOMICS WITH DATA SCIENCE from young number 1 university of my country,which I’m actually very fascinated about. I am from a stem background so i am just a little bit confused that it would be hard, and even after my computer science i will be specialising in Data Science and become data scientist. I am thinking that pursuing economics with data science may broad my field as i could pursue Masters in finance or economics or data science or even EMBA? Please if you can list out pros and cons and suggest me what should i do?",tabby123456781,2020-02-28 07:33:53,1,143,17.07,6.21,79.18,4.49,23.83,22.38,83.92,55.94,18.88,13.99,13.29,0,0.7,0,0,4.9,1.4,11.19,14.69,5.59,7.69,0,16.78,4.2,2.1,2.1,1.4,1.4,3.5,0.7,2.8,2.1,0.7,0,2.8,0,0.7,0,0.7,13.29,2.8,0,3.5,6.29,0,4.9,0.7,0,0,0.7,0,0,0,0,0,1.4,0.7,0,0.7,0,0,0,10.49,2.1,8.39,0.7,5.59,2.1,11.89,0,0,3.5,0,0,1.4,0.7,1.4,0,0,0,8.39,2.1,2.8,0,0,2.1,0,0,0,1.4,0,0
fax2a9,Right major for a job in Robotics,Is being a Machine Learning major in CS make you better fit for working with Robotics than being an Electronic Engineering major?,owaminkosi,2020-02-28 08:15:13,4,29,99,63.49,47.93,85.87,14.5,24.14,68.97,44.83,3.45,3.45,0,0,3.45,0,0,0,10.34,20.69,10.34,0,0,0,20.69,6.9,6.9,0,0,0,3.45,3.45,0,0,0,0,3.45,0,0,0,0,10.34,3.45,3.45,0,0,0,3.45,0,0,0,0,0,0,0,0,0,6.9,0,6.9,0,3.45,0,0,6.9,0,13.79,0,13.79,0,10.34,0,0,0,0,0,0,0,0,0,0,0,3.45,0,0,0,0,3.45,0,0,0,0,0,0
fb96oc,Implementation of sqrt(x) using JavaScript - 100 Days of Leetcode Challenge - Day 5,,Meikandanathan,2020-02-28 23:33:11,0,13,99,50,17.46,99,13,30.77,46.15,15.38,0,0,0,0,0,0,0,0,0,15.38,0,0,0,0,7.69,0,0,0,15.38,0,7.69,7.69,0,0,0,0,0,0,0,0,0,7.69,0,7.69,0,0,0,0,0,0,0,0,0,0,0,0,0,7.69,0,7.69,0,0,0,0,0,0,15.38,0,0,15.38,7.69,0,0,0,0,0,0,0,0,0,0,0,30.77,0,0,0,0,0,0,15.38,0,0,15.38,0
fbgf31,Coding For Kids in Python Video Series,"Hello Everyone,

I am trying to reach more parents and kids to teach them how to Code in Python. These video tutorials are very basic and easy to understand for kids.

Please share and help me grow my audience.

My latest video in the series is Part 7 and you can watch it here - [Coding For Kids in Python Part 7](https://www.youtube.com/watch?v=QWdx0auE2uc)",dailymcoffee,2020-02-29 10:07:01,8,76,74.24,85.38,13.83,90.71,15.2,9.21,80.26,42.11,11.84,7.89,5.26,0,1.32,0,1.32,3.95,1.32,14.47,5.26,3.95,6.58,0,7.89,5.26,2.63,1.32,2.63,6.58,3.95,3.95,0,0,0,0,14.47,1.32,0,0,0,5.26,1.32,1.32,0,1.32,1.32,0,6.58,6.58,0,0,0,0,0,0,0,7.89,5.26,1.32,2.63,0,0,0,11.84,0,7.89,1.32,5.26,1.32,2.63,5.26,0,0,0,0,1.32,0,1.32,0,0,0,19.74,6.58,1.32,0,0,1.32,0,1.32,0,0,2.63,6.58
fc6qov,Programming Real Time 3D reconstruction,"Hey guys! I recently wrote an article on an overview of a famous 3D reconstruction algorithm KinectFusion and how to implement it in C++. Hope you guys can check it out!

Link:

[https://medium.com/@taying.cheng/understanding-real-time-3d-reconstruction-and-kinectfusion-33d61d1cd402](https://medium.com/@taying.cheng/understanding-real-time-3d-reconstruction-and-kinectfusion-33d61d1cd402)",tt12343,2020-03-01 20:38:15,0,71,90.22,71.35,50.85,52.17,14.2,21.13,52.11,23.94,5.63,2.82,1.41,0,1.41,0,0,2.82,4.23,7.04,1.41,1.41,5.63,0,2.82,1.41,1.41,1.41,2.82,0,1.41,1.41,0,0,0,0,5.63,0,2.82,0,2.82,12.68,9.86,1.41,1.41,1.41,0,0,0,0,0,0,0,0,0,0,0,1.41,0,0,1.41,0,0,1.41,2.82,1.41,11.27,0,5.63,5.63,8.45,0,0,0,0,0,4.23,0,2.82,0,0,0,50.7,7.04,0,1.41,0,0,2.82,19.72,0,0,2.82,16.9
fcjsbq,Interesting findings from a recent research: language ability is a better predictor of math for programming,,Motunaga,2020-03-02 13:56:45,4,16,99,73.4,7.84,99,16,43.75,100,37.5,0,0,0,0,0,0,0,0,12.5,18.75,6.25,0,0,0,6.25,12.5,12.5,0,0,0,12.5,12.5,0,0,0,0,6.25,0,0,0,0,6.25,6.25,0,0,0,0,0,0,0,0,0,0,0,0,0,0,12.5,0,12.5,0,6.25,0,0,6.25,6.25,6.25,0,0,6.25,18.75,0,0,0,0,0,0,0,0,0,0,0,6.25,0,0,6.25,0,0,0,0,0,0,0,0
fdluai,Free PDF: Creative Coding for Kids,"Hello CSEducation community,

I just want to share with you the news about a new edition of Creative Coding for Kids book by Tariq Rashid.

Tariq is an extraordinary educator with a big passion for writing. He has been nicely enough to share a free version of his book with [codeguppy.com](https://codeguppy.com/) users.

🖨 Free download:

[https://codeguppy.com/site/download/tariq/creative\_coding\_for\_kids.pdf](https://codeguppy.com/site/download/tariq/creative_coding_for_kids.pdf)

&amp;#x200B;

https://preview.redd.it/166r3vuwoqk41.png?width=1920&amp;format=png&amp;auto=webp&amp;s=53dc58217232b82b62bd95c90774f2c6319decd6

If you are teaching coding to beginners... then this book may be for you.

If you enjoy this book, you may find author's youtube channel also very interesting: [https://www.youtube.com/channel/UCO6iBPzIvUdzxcf87BN24FQ](https://www.youtube.com/channel/UCO6iBPzIvUdzxcf87BN24FQ)",codeobserver,2020-03-04 15:23:39,2,161,89.87,83.99,1,99,23,21.74,57.14,27.95,6.83,4.97,0.62,0,3.11,1.24,0,1.86,3.11,9.94,4.35,2.48,2.48,0,6.21,5.59,0,0,1.86,0,8.07,8.07,0,0,0,0,9.32,0,0,0,1.24,6.83,0.62,2.48,1.86,2.48,0,1.86,0,0,0,0,1.24,0.62,0.62,0.62,0,6.21,2.48,2.48,1.24,0,0,0.62,4.97,1.86,3.73,0,2.48,1.24,4.35,6.21,0,1.86,0,0,3.73,0,3.73,0,0,0,50.93,12.42,1.24,1.86,3.11,0.62,0,0,0,0.62,3.73,27.33
fdmqs5,Type-In programs for young coders,"Back in the 80s in was very popular to type in BASIC code from magazines and books. Those type-in programs helped a whole generation of kids to appreciate coding!

Type-in books are almost nonexistent. Most printed code listings are not intended to be typed in.

&amp;#x200B;

What do you say about a book for young coders with very small type-in programs? 

Do you think this kind of book would be useful to a coding club or coding class?

&amp;#x200B;

This are some examples from a project I started:

&amp;#x200B;

https://preview.redd.it/6wldm9nf0rk41.png?width=1500&amp;format=png&amp;auto=webp&amp;s=d5356965a0a2ef0383c0144ea6fbee92d2607637

&amp;#x200B;

https://preview.redd.it/ct8knzfg0rk41.png?width=1500&amp;format=png&amp;auto=webp&amp;s=31e628dfbfb5cd368110f3ef14f2b76155e4073e",codeobserver,2020-03-04 16:28:53,0,149,91.93,57.97,10.35,63.95,18.62,14.09,55.7,32.89,6.04,2.01,0.67,0,1.34,0,0,4.03,3.36,12.75,6.04,3.36,1.34,0.67,9.4,4.03,0.67,0.67,2.01,2.01,2.01,2.01,0,0,0,0,3.36,0,0,0,0,6.71,1.34,0.67,0.67,3.36,0,1.34,0.67,0,0.67,0,0,0,0,0,0,1.34,0.67,0,0.67,0,0,2.68,6.04,0,10.74,0,8.05,3.36,6.71,4.03,0,0,0,0,1.34,0,1.34,0,0,0,39.6,6.04,0,0.67,9.4,2.68,0.67,2.68,0,0,0,17.45
fdmrl7,Type-In programs. Are they still relevant?,"Back in the 80s in was very popular to type in BASIC code from magazines and books. Those type-in programs helped a whole generation of kids to appreciate coding!

Type-in books are almost nonexistent. Most printed code listings are not intended to be typed in.

&amp;#x200B;

What do you say about a book for young coders with very small type-in programs?

Do you think this kind of book would be useful to a coding club or coding class?

&amp;#x200B;

This are some examples from a project I started:

&amp;#x200B;

https://preview.redd.it/lfuayu731rk41.png?width=1500&amp;format=png&amp;auto=webp&amp;s=394e1f84a86d93496cb12aff6f64d337686cab82

&amp;#x200B;

https://preview.redd.it/7stv1g141rk41.png?width=1500&amp;format=png&amp;auto=webp&amp;s=15f5709a4217c0dd9317010594154022931daa20",codeobserver,2020-03-04 16:30:33,4,156,88.9,60.13,8.65,62.24,17.33,14.1,54.49,32.69,6.41,2.56,0.64,0,1.28,0,0.64,3.85,3.21,11.54,6.41,3.85,1.28,0.64,9.62,3.85,0.64,0.64,3.21,1.92,1.92,1.92,0,0,0,0,3.85,0,0,0,0,6.41,1.28,0.64,0.64,3.21,0,1.28,0.64,0,0.64,0,0,0,0,0,0,1.28,0.64,0,0.64,0,0,2.56,6.41,0,10.26,0,7.69,3.21,6.41,3.85,0,0,0,0,1.28,0,1.28,0,0,0,39.1,6.41,0,0.64,8.97,3.21,0.64,2.56,0,0,0,16.67
fe5ekr,MSc Data Science programs in Europe and North America?,"I'm looking into MSc Data Science programs in Europe and North America.

Any recommendations?

Cheers.",thelazarus0,2020-03-05 16:54:05,1,24,88.46,50,74.76,92.4,6,33.33,66.67,25,4.17,4.17,4.17,0,0,0,0,0,0,12.5,4.17,0,8.33,0,8.33,0,0,0,0,4.17,4.17,4.17,0,0,0,0,4.17,0,0,0,0,4.17,0,0,0,4.17,0,0,4.17,4.17,0,0,0,0,0,0,0,0,0,0,0,0,0,0,4.17,0,20.83,0,20.83,0,16.67,0,0,0,0,0,0,0,0,0,0,0,20.83,8.33,0,0,0,8.33,0,0,0,4.17,0,0
fe812k,Really cool object oriented programming guide,I came up with this cool article on OOPs(Object Oriented Programming). This explains each concepts of OOPs in very simple way. Do check this [Object oriented programming guide](https://www.xamnation.com/object-oriented-programming/),rakesh3368,2020-03-05 20:17:19,2,43,87.78,40.82,34.47,95.29,10.75,27.91,55.81,27.91,9.3,2.33,2.33,0,0,0,0,6.98,0,11.63,2.33,4.65,0,0,6.98,6.98,0,0,0,2.33,4.65,4.65,0,0,0,0,2.33,0,0,0,0,4.65,2.33,0,0,0,0,2.33,4.65,0,0,4.65,0,0,0,0,0,2.33,0,0,2.33,0,0,2.33,4.65,0,11.63,2.33,9.3,0,9.3,0,0,0,0,0,6.98,0,2.33,4.65,0,0,34.88,9.3,0,0,0,0,0,4.65,0,0,9.3,11.63
fef1sj,CS Ed Podcast 3 - Debugging,,zamansky,2020-03-06 07:29:46,0,5,93.26,50,1,25.77,5,40,20,0,0,0,0,0,0,0,0,0,0,0,0,0,0,0,0,0,0,0,20,0,0,0,0,0,0,0,0,0,0,0,0,0,0,0,0,0,0,0,0,0,0,0,0,0,0,0,0,0,0,0,0,0,0,0,0,0,0,0,0,0,0,20,0,0,0,0,0,0,0,0,0,0,20,0,0,0,0,0,0,20,0,0,0,0
fep4b0,Jobs in Research Labs between PhD and Masters,"I am in my Masters in Computer Science. I am graduating in December 2020. I want to start my PhD in Fall 2021. However, being in the US is expensive and I was wondering if any labs give research jobs to students who have just completed Masters. I will be grateful for any advice.",sanyameepatel,2020-03-06 19:05:41,3,62,54.54,25.93,85.77,56.22,10.33,25.81,93.55,53.23,14.52,12.9,11.29,1.61,0,0,0,1.61,1.61,16.13,12.9,3.23,6.45,0,19.35,0,0,1.61,3.23,3.23,1.61,1.61,0,0,0,0,6.45,0,0,0,0,11.29,1.61,0,3.23,6.45,1.61,3.23,0,0,0,0,0,0,0,0,0,11.29,1.61,0,9.68,0,0,3.23,12.9,1.61,14.52,1.61,9.68,3.23,20.97,0,0,1.61,0,0,0,0,0,0,0,0,9.68,8.06,1.61,0,0,0,0,0,0,0,0,0
fepekn,Teaching collision detection,,megabeano,2020-03-06 19:29:11,2,3,93.26,50,1,25.77,3,100,33.33,0,0,0,0,0,0,0,0,0,0,0,0,0,0,0,0,0,0,0,0,0,0,0,0,0,0,0,0,0,0,0,0,0,0,0,0,0,0,0,0,0,0,0,0,0,0,0,0,33.33,0,0,33.33,0,0,0,0,0,0,0,0,0,33.33,0,0,0,0,0,0,0,0,0,0,0,0,0,0,0,0,0,0,0,0,0,0,0
fg0rtq,SIGCSE Taking Place?,"Hi,

I was wondering whether anybody knew if SIGCSE 2020 will happen. Their website was updated last time during December, and there haven't been any COVID - related news. Thanks.",torp3do_,2020-03-09 13:00:42,4,32,11.86,37.72,99,81.93,8,21.88,81.25,40.62,9.38,6.25,3.12,0,0,0,3.12,3.12,0,3.12,15.62,3.12,9.38,3.12,31.25,0,0,3.12,3.12,3.12,3.12,3.12,0,0,0,0,12.5,0,0,0,0,25,9.38,0,3.12,12.5,0,9.38,0,0,0,0,0,0,0,0,0,6.25,3.12,0,0,3.12,0,12.5,9.38,3.12,18.75,0,3.12,15.62,0,0,0,0,0,0,0,0,0,0,0,0,25,9.38,6.25,0,0,3.12,0,3.12,0,3.12,0,0
fg30bg,Quantum Tetris,"Hey r/CSEducation, check out our senior thesis project Quantum Tetris - a simple game that teaches you the basics of quantum computing. It’s a fun take on Tetris and the quantum twists actually makes it quite challenging!

Read about the project: [https://medium.com/@tglasgow31/quantum-tetris-6452a0c96227](https://medium.com/@tglasgow31/quantum-tetris-6452a0c96227)

Play our game here: [http://quantumtetris.com/](http://quantumtetris.com/)",QuantumTetris,2020-03-09 15:16:34,9,75,90.41,85.7,1,91.14,18.75,22.67,54.67,24,8,4,0,2.67,1.33,0,0,4,6.67,5.33,1.33,4,1.33,0,6.67,2.67,0,0,2.67,0,4,4,0,0,0,0,8,0,0,0,0,4,0,1.33,0,1.33,0,1.33,0,0,0,0,0,0,0,0,0,10.67,5.33,1.33,2.67,1.33,0,0,4,0,5.33,1.33,2.67,1.33,10.67,5.33,0,0,0,0,8,0,6.67,0,0,0,48,6.67,1.33,2.67,0,0,1.33,6.67,0,1.33,5.33,22.67
fgp7h6,Learn to cook with augmented reality,"Hey r/CSEducation, a team and I recently worked on a senior capstone project using the Magic Leap One headset. It's called Cook Along and it aims to make cooking easier. Users can walk through through the steps of a recipe, manage multiple timers, and watch instructional videos all within the AR app.

Check out our demo video here: [https://www.youtube.com/watch?v=-GfqqM0rMhk&amp;t=1s](https://www.youtube.com/watch?v=-GfqqM0rMhk&amp;t=1s)

And read more about it (and some thoughts about Magic Leap's potential) here: [https://medium.com/@zjohnson5455/augmented-reality-will-save-your-dinner-1c3c0196e6b7](https://medium.com/@zjohnson5455/augmented-reality-will-save-your-dinner-1c3c0196e6b7)

This is intended primarily as a proof of concept and a learning experience. We would love to hear your thoughts and suggestions. Thanks!",z5455,2020-03-10 18:35:58,0,155,88.86,86.36,1.43,83.22,22.14,20,66.45,30.97,6.45,3.87,0.65,1.29,1.94,0,0,2.58,5.16,9.68,3.87,3.23,5.16,0,10.97,2.58,2.58,0,1.94,2.58,3.23,3.23,0,0,0,0,8.39,0,1.29,1.29,0,7.74,2.58,1.94,0.65,1.29,1.29,0,4.52,3.23,0.65,0,3.87,0,0,0,3.23,6.45,3.87,1.94,1.29,0,0,1.29,8.39,1.94,5.16,1.29,1.94,1.94,5.81,5.16,0,0,0,0,5.81,0,5.16,0,0,0,42.58,7.1,1.94,1.29,1.29,1.29,0.65,9.03,0,1.29,3.87,14.84
fgrjql,Software/app for teacher to review student's code,"School has just been closed here recently due to the virus outbreak. Does anyone if there are any software or apps that lets me set programming tasks for my students, allow them to submit their code to me for review. I know it's possible using repl.it, I've used that in class previously with my student, but are there other alternatives? Because some of my students don't have access to computers at home, and will most likely use their phones. It won't be for complicated programming tasks, but simple ones to teach them the basics.

Just looking for alternatives like I said, repl.it has been excellent, because I can create classes, set out tasks and check their code. Only problem is it's not mobile friendly.",letsmakefarts,2020-03-10 21:31:40,21,134,28.02,25.08,30.32,39.08,16.75,17.91,88.81,53.73,17.91,11.19,6.72,0.75,0,0,3.73,6.72,1.49,12.69,12.69,4.48,5.97,2.24,18.66,2.99,2.24,0,0,2.24,2.99,1.49,0.75,0,0,0,7.46,0,0.75,0,0,17.91,1.49,5.22,1.49,5.97,0,5.97,2.24,0.75,1.49,0,0,0,0,0,0,10.45,1.49,1.49,5.97,0.75,0.75,3.73,11.94,1.49,5.22,0,2.99,2.24,13.43,0,0.75,0,0,0,1.49,0,1.49,0,0,0,17.91,5.97,5.97,0,0,0.75,0,0,0,4.48,0,0.75
fgx6vh,"To broaden access and challenge stereotypes, I made a FREE CS Colouring Book.","Cross posting from r/compsci   


I've been thinking about how to make Computer Science more accessible and appealing to a wider demographic. Many stereotypes about Computer Scientists need challenging. So I made a Computer Science Colouring Book!  
 

Sneak preview in the video below. FREE digital copies available here with lots of other free CS ed resources (mainly aimed at middle and high school): [http://bit.ly/3cLlfAp](http://bit.ly/3cLlfAp)   
 

![video](vg0f9h2tn1m41)

If you want to support me by buying ready-made printed physical copies, these are also available at [http://bit.ly/38FHG6O](http://bit.ly/38FHG6O) or on Amazon: [https://amzn.to/3aN4EdC](https://amzn.to/3aN4EdC)",fresher123,2020-03-11 06:31:38,0,134,90.92,35.44,2.99,94.38,22.33,22.39,67.91,29.1,5.22,3.73,2.99,0,0.75,0,0,1.49,2.99,12.69,2.24,4.48,5.97,0,8.21,6.72,2.24,0.75,0,5.22,5.97,5.22,0.75,0,0,0,0.75,0,0,0,0,9.7,0.75,3.73,2.24,2.99,0,2.24,2.99,2.99,0,0,0.75,0,0.75,0,0,4.48,0,1.49,1.49,1.49,0,2.99,4.48,0,5.97,0,5.97,0,8.96,2.99,0,2.99,0,0,5.97,0,5.97,0,0,0,35.07,7.46,1.49,0.75,0,0,1.49,0.75,0,0.75,6.72,15.67
fh7yuk,"We're working together to get better at computer science, join us!","Surprise, Surprise! Who's online and wants to get better at programming and algorithms?

There's this awesome app called [binarysearch.io](http://binarysearch.io/) where you code with friends and colleagues on challenges and more!

Join us with this conversation on the slack: [https://join.slack.com/t/programmingpals-group/shared\_invite/zt-clhqd2ok-90NyBBoJULpuL7iH0louBA](https://join.slack.com/t/programmingpals-group/shared_invite/zt-clhqd2ok-90NyBBoJULpuL7iH0louBA)",aoa2303,2020-03-11 18:02:22,1,84,85.8,98.33,1,99,16.8,25,65.48,26.19,8.33,4.76,0,3.57,1.19,0,0,3.57,1.19,9.52,1.19,2.38,4.76,0,16.67,4.76,3.57,2.38,0,3.57,9.52,9.52,0,0,0,0,16.67,0,2.38,0,0,1.19,0,0,1.19,0,0,0,0,0,0,0,0,0,0,0,0,25,17.86,4.76,0,4.76,0,3.57,11.9,1.19,7.14,0,7.14,0,9.52,0,0,0,0,0,5.95,0,4.76,1.19,0,0,53.57,7.14,2.38,1.19,0,1.19,3.57,7.14,0,3.57,4.76,22.62
fi1zr2,Transition your CS course quickly online with zyBooks,"Hello all,

&amp;#x200B;

As CS educators you're faced with serious decisions about how to run your current or upcoming courses without a face-to-face presence. zyBooks is offering free courseware for your computer science (and math/engineering) courses for the rest of the spring term. More info here: [https://www.zybooks.com/covid-19-care-package/](https://www.zybooks.com/covid-19-care-package/)

&amp;#x200B;

zyBooks is a professor-founded company that educates hundreds of thousands of students per year, at 600+ universities. We author high quality content for most of the common CS curriculum and deliver it on a modern and easy-to-use platform. Dozens of courses already use it for online \_only\_ instruction with much success.

&amp;#x200B;

We are also offering zyLabs, our lab autograder system, to you and your students for free. Just define your lab requirements and test cases for C/C++/Java/Python/MATLAB/CSS+HTML programs, and your students can write and submit code directly on the website. We'll also share with you a full set of curated lab assignments tuned for CS1/CS2 courses to get you on your way.

&amp;#x200B;

Sincerely,

The zyBooks team",TheRealzyBooks,2020-03-13 09:06:55,1,208,89.53,94.35,5.76,84.92,20.8,25.48,69.23,36.06,8.65,7.21,0,1.92,5.29,0,0,1.44,4.33,13.94,2.88,3.85,5.77,0.48,6.73,5.29,1.44,0.48,2.88,1.92,4.33,3.85,0.48,0,0,0,10.1,0,0,0,0,5.77,1.44,1.92,0,0.96,0.96,0.96,0,0,0,0,0.96,0.96,0,0,0,7.69,3.37,1.44,2.88,0.96,0,0.96,7.21,0.96,9.13,1.44,4.33,3.37,11.54,0.48,0,0.96,0,0,0.96,0,0.96,0,0,0,36.06,5.77,2.88,0.48,3.85,0,0,5.29,0,0.96,1.92,14.9
fi755g,Draw with Python and the arcade library,,pvc,2020-03-13 14:25:15,0,7,99,50,1,25.77,7,14.29,57.14,42.86,0,0,0,0,0,0,0,0,14.29,14.29,0,0,14.29,0,0,0,0,0,0,0,0,0,0,0,0,0,0,0,0,0,0,0,0,0,0,0,0,0,0,0,0,0,0,0,0,0,0,0,0,0,0,0,0,0,0,0,0,0,0,0,14.29,0,0,0,0,0,0,0,0,0,0,0,0,0,0,0,0,0,0,0,0,0,0,0
